[E3-REPLAY-1-PROOF] stage=1 label=boot-regressions result=PASS
[E3-REPLAY-1-PROOF] stage=2 label=sheet-replay-sha256 result=PASS
[REPLAY] shadowWriteGuard relayStateMutations=0 result=PASS
[E3-REPLAY-1-PROOF] stage=3 label=module-replay-clean result=PASS
[E3-REPLAY-1-PROOF] stage=4 label=partial-replay-range result=PASS
[E3-REPLAY-1-PROOF] stage=5 label=divergence-detection result=PASS
[E3-REPLAY-1-PROOF] stage=6 label=divergence-scar result=PASS
[E3-REPLAY-1-PROOF] stage=7 label=performance-gate result=PASS
[E3-REPLAY-1-PROOF] stage=8 label=headless-replay-parity result=PASS
[E3-REPLAY-1-PROOF] stage=9 label=non-interference result=PASS
[E3-REPLAY-1-PROOF] gate-summary result=PASS stages=9/9
[ENU] Coordinate system loaded - all geometry in meters
[HEADLESS] mode=FORCED reason=urlParam
20:02:09.791 ℹ️ [GLOBE] imagery mode=osm provider=OpenStreetMap
20:02:09.794 ℹ️ [PRES] colorCorrection added=PASS vignette=ON coolTone=ON
20:02:09.795 ℹ️ [PRES] postFX enabled=PASS fxaa=ON bloom=ON colorCorrect=ON
20:02:09.795 ℹ️ [PRES] fog enabled=PASS density=0.00048
20:02:09.797 ⚠️ ⚠️ Buildings marked as DEGRADED
20:02:09.798 ℹ️ [LAUNCH-FIX] basemapDim brightness=0.28 contrast=0.55 saturation=0.05 gamma=1.6 applied=PASS
20:02:09.798 ℹ️ [LAUNCH] visibilityMode enabled=PASS scale=0.25 trunkPrimitive=cylinder widthFloors=ON basemapDimming=ON
20:02:09.798 ℹ️ [PRES] environmentDeemphasis applied=PASS brightness=0.28 saturation=0.05 gamma=1.6
20:02:09.799 ℹ️ [GLOBE] services weatherBase=http://127.0.0.1:4020
20:02:09.799 ℹ️ [GLOBE] imagery registry enabled modes=local,clean-street,satellite,hybrid,osm,dark,minimalist
20:02:09.799 ℹ️ [CAM] restore-POV skipped for launch (deterministic frame)
20:02:09.800 ℹ️ [INPUT] owner=CAMERA mode=FreeFly reason=default
[RelationshipRenderer] Initialized
[RelationshipRenderer] Cleared all relationships
[BoundaryRenderer] DataSource created and added to viewer
[BoundaryRenderer] Initialized
[BoundaryRenderer] Loading ISR from data/boundaries/countries/ISR-ADM0.geojson
[BoundaryRenderer] Loading USA from data/boundaries/countries/USA-ADM0.geojson
20:02:09.801 ℹ️ [BOUNDARY-EDITOR] Initialized
[FILAMENT] registry initialized=PASS total=6
[DISCLOSURE] restore backend=localStorage loaded=0 result=PASS
[TIMEBOX] event type=DISCLOSURE_CHANGE id=FIL-003 applied=PASS target=trunk.avgol timeboxId=T6
[DISCLOSURE] id=FIL-003 from=PRIVATE to=WITNESSED reason=lifecycle_default result=PASS
[DISCLOSURE] persist backend=localStorage stored=6 result=PASS
[TIMEBOX] event type=DISCLOSURE_CHANGE id=FIL-004 applied=PASS target=trunk.avgol timeboxId=T6
[DISCLOSURE] id=FIL-004 from=PRIVATE to=PUBLIC_SUMMARY reason=lifecycle_default result=PASS
[DISCLOSURE] persist backend=localStorage stored=6 result=PASS
[TIMEBOX] event type=DISCLOSURE_CHANGE id=FIL-005 applied=PASS target=trunk.avgol timeboxId=T6
[DISCLOSURE] id=FIL-005 from=PRIVATE to=PUBLIC_SUMMARY reason=lifecycle_default result=PASS
[DISCLOSURE] persist backend=localStorage stored=6 result=PASS
[TIMEBOX] event type=DISCLOSURE_CHANGE id=FIL-006 applied=PASS target=trunk.avgol timeboxId=T6
[DISCLOSURE] id=FIL-006 from=PRIVATE to=WITNESSED reason=lifecycle_default result=PASS
[DISCLOSURE] persist backend=localStorage stored=6 result=PASS
[GroupMarkerNotSet(crbug.com/242999)!:A0F0230004460000]Automatic fallback to software WebGL has been deprecated. Please use the --enable-unsafe-swiftshader (about:flags#enable-unsafe-swiftshader) flag to opt in to lower security guarantees for trusted content.
[.WebGL-0x1e7c02a89c00]GL Driver Message (OpenGL, Performance, GL_CLOSE_PATH_NV, High): GPU stall due to ReadPixels
[.WebGL-0x1e7c02a89c00]GL Driver Message (OpenGL, Performance, GL_CLOSE_PATH_NV, High): GPU stall due to ReadPixels
[BoundaryRenderer] ✅ ISR: Loaded 1/1 features
[.WebGL-0x1e7c02a89c00]GL Driver Message (OpenGL, Performance, GL_CLOSE_PATH_NV, High): GPU stall due to ReadPixels
[BoundaryRenderer] ✅ USA: Loaded 1/1 features
20:02:10.399 ℹ️ [BOUNDARY] containsll suite=PASS polygons=1 multipolygons=1 holes=0
20:02:10.400 ℹ️ [BOUNDARY] containsll hole-suite=PASS probes=3
20:02:10.400 ℹ️ [BOUNDARY] restore result=PASS renderer=BoundaryRenderer containsLL=PASS ISR=1 USA=1
20:02:10.400 ℹ️ [GATE] G3 status=PASS evidence=runtime-boundary-selftest
20:02:10.401 ℹ️ [UX] boundaries=ACTIVE mode=READ_ONLY
20:02:10.401 ℹ️ [BOUNDARY] voting-scope mode=BOUNDARY_ENABLED reason=boundary-pass
[.WebGL-0x1e7c02a89c00]GL Driver Message (OpenGL, Performance, GL_CLOSE_PATH_NV, High): GPU stall due to ReadPixels (this message will no longer repeat)
20:02:10.744 ℹ️ [BOUNDARY] manifestLoaded countries=27
[BoundaryRenderer] Loading USA from data/boundaries/countries/USA-ADM0.geojson
[BOUNDARY] reuse id=boundary-USA-0-6c62914d
[BoundaryRenderer] Loading BRA from data/boundaries/countries/BRA-ADM0.geojson
20:02:11.658 ℹ️ [VOTE] restore backend=localStorage mode=demo loaded=0 result=PASS
[VOTE] restore backend=localStorage mode=demo loaded=0 result=PASS
[BACKING] id=branch.finance filaments=3 timeboxes=7 evidence=0 missing=0
[CONF] id=branch.finance conf=0.40 breakdown=tb:1,ev:0,disc:1,vote:0
[ATTN] id=branch.finance attn=0.20 lifecycle=SETTLING disclosure=WITNESSED vote=PENDING
[BACKING] id=branch.maintenance filaments=3 timeboxes=7 evidence=0 missing=0
[CONF] id=branch.maintenance conf=0.40 breakdown=tb:1,ev:0,disc:1,vote:0
[ATTN] id=branch.maintenance attn=0.36 lifecycle=REFUSAL disclosure=PUBLIC_SUMMARY vote=PENDING
[AC] aggregateAttention scope=company result=0.36 children=8
[AC] aggregateConfidence scope=company result=0.35 children=8
[AC] initialized=PASS functions=5 filaments=6
20:02:11.739 ℹ️ [PRES] launchTransform scale=0.25 uOffset=0 applied=PASS
20:02:11.741 ℹ️ [LAUNCH-FIX] visualHierarchy applied=PASS tilesAlpha=0.018 trunkCore=0.96 branchAlpha=0.18
20:02:11.741 ℹ️ [LAUNCH-THEME] tokens loaded trunk=thinPillar tile=horizontalPlatform filament=rain
20:02:11.742 ℹ️ [GATE] launchVisibility semantics=UNCHANGED enuChecks=RAW
20:02:11.742 ℹ️ [LAUNCH] widthFloors trunk=20m branches=13/10/6 tiles=90x52m rule=uniform
20:02:11.742 ℹ️ [PRES] trunkStyle applied=PASS mode=core+shell coreR=12 shellR=20
20:02:11.742 ℹ️ [PRES] branchStyle applied=PASS ribMode=ON ribScale=0.18 emissive=ON alpha=0.18
20:02:11.743 ℹ️ [PRES] sheetPlatform grid=PASS majorLines=16 mode=overview normal=UP horizontal=ON landscape=120x70
20:02:11.743 ℹ️ [PRES] tileFloatMode=PASS supportFilaments=ON fillAlpha=0.018 borderAlpha=1.0
20:02:11.743 ℹ️ [PRES] filamentRain enabled=PASS density=2
20:02:11.744 ℹ️ [PRES] rootGlow enabled=PASS radius=80 alpha=0.10
20:02:11.745 ℹ️ [GATE 4] Anchor marker rendered at (34.7818, 32.0853) - independent of buildings/terrain
20:02:11.747 ℹ️ [PRES] tether rendered=PASS
20:02:11.748 ℹ️ [PRES] buildingAnchorProxy rendered=PASS reason=buildings-degraded
20:02:11.748 ℹ️ [GATE 4] Anchor marker rendered at (34.7818, 32.0853) - independent of buildings/terrain
20:02:11.749 ℹ️ [GATE 4] Anchor marker rendered at (34.7818, 32.0853) - independent of buildings/terrain
20:02:11.750 ℹ️ [GATE 4] Anchor marker rendered at (34.7818, 32.0853) - independent of buildings/terrain
20:02:11.750 ℹ️ [GATE 4] Anchor marker rendered at (34.7818, 32.0853) - independent of buildings/terrain
20:02:11.751 ℹ️ [GATE 4] Anchor marker rendered at (34.7818, 32.0853) - independent of buildings/terrain
20:02:11.751 ℹ️ [VIS] voteFilter LOD=COMPANY override=ALL
20:02:11.755 ℹ️ [UX] debugLogs=false gateSpamSuppressed=true
20:02:11.760 ℹ️ [PRES] junctions rendered=PASS count=8
20:02:11.761 ℹ️ [VIS2] expandedSheetsAllowed=false scope=world
20:02:11.761 ℹ️ [VIS2] suppressSheetDetail=true expandedSheetsAllowed=false selectedSheet=none lod=COMPANY
20:02:11.762 ℹ️ [VIS-LAUNCH] ringContainment mode=collapsed action=suppressNonFocused result=PASS
[FILAMENT] bandSnap id=FIL-001 timeboxId=FIN-T4 deltaM=0 result=PASS
[FILAMENT] bandSnap id=FIL-002 timeboxId=FIN-T3 deltaM=0 result=PASS
[FILAMENT] bandSnap id=FIL-003 timeboxId=FIN-T1 deltaM=0 result=PASS
[FILAMENT] bandSnap id=FIL-004 timeboxId=MNT-T0 deltaM=0 result=PASS
[FILAMENT] bandSnap id=FIL-006 timeboxId=MNT-T1 deltaM=0 result=PASS
[FILAMENT] bandSnap source=vis4Registry
[DISCLOSURE] markersRendered count=5 tiers={PRIVATE:2,WITNESSED:2,PUBLIC_SUMMARY:1,FULL_PUBLIC:0}
20:02:11.764 ℹ️ [VIS2] deptSpinesRendered count=8
20:02:11.764 ℹ️ [VIS2] companyCollapsed result=PASS sheetsRendered=0 lod=COMPANY scope=world expandedSheetsAllowed=false
20:02:11.770 ℹ️ [VIS2] sheetTilesRendered count=39
20:02:11.771 ℹ️ [VIS2] exitSheet collapsed=PASS expanded=0 tiles=39
20:02:11.773 ℹ️ [VIS3] flowOverlay result=PASS edges=66 exceptions=11 scope=world lod=COMPANY
20:02:11.774 ℹ️ [VIS3] trafficBarsRendered count=8
20:02:11.774 ℹ️ [VIS3] gate-summary result=PASS
20:02:11.776 ℹ️ [VIS4c] labelsRendered count=36 scope=company
20:02:11.777 ℹ️ [VIS4] slabsRendered scope=company objects=9 slabs=36 capped=false
20:02:11.777 ℹ️ [VIS4] companySlabs result=PASS deptBranches=8 trunkSlabs=6
20:02:11.777 ℹ️ [VIS4] gate-summary result=PASS
20:02:11.778 ℹ️ [LOD-BUDGET] frame sheetsDetailed=0 totalMarkers=0 totalPrims=125 totalEntities=97
[BoundaryRenderer] ✅ BRA: Loaded 1/1 features
[BoundaryRenderer] Loading ARG from data/boundaries/countries/ARG-ADM0.geojson
20:02:13.542 ℹ️ [GLOBE] worldTrunks synced added=15 total=16
20:02:13.543 ℹ️ [GLOBE] datasetLoad anchors=6
20:02:13.543 ℹ️ [UX] multiCountrySmoke=PASS anchors=6
20:02:13.544 ℹ️ [LAUNCH-FIX] cameraFrame target=trunk.avgol result=PASS distM=750 horzM=1000 heading=355 pitch=-28 applied=PASS
20:02:13.545 ℹ️ [HUD] mode=FreeFly layer1=6 layer2=0
20:02:13.549 ℹ️ [HUD] consolidated rootCount=1 duplicates=0
20:02:13.553 ℹ️ [HUD] tier1 rows=6
20:02:13.553 ℹ️ [HUD] tier2 default=collapsed
20:02:13.554 ℹ️ [PRES] billboard=ON reason=launch-default
20:02:13.554 ℹ️ [UX] debugLogs=false (launch mode)
20:02:13.554 ℹ️ [LAUNCH-FIX] uiGating launch=true hiddenPanels=artifacts,ux3,p2p,topicLane,vote,workMode,logConsole applied=PASS
20:02:13.560 ℹ️ [LAUNCH-FIX] hud tier1=ON tier2=OFF default=collapsed
20:02:13.560 ℹ️ [LAUNCH-FIX] helpOverlay shown=true dismissed=false source=first
[BUILD] 2026-02-09T12:30Z ux-1.1-universal-object-contract
20:02:13.561 ℹ️ [UX-1.1-PROOF] type=trunk id=trunk.avgol scope=root actions=focusView,showKPIs,showTimeboxes,showBranches,cycleClusterLevel,focusNextRegion,loadGlobalCore
20:02:13.562 ℹ️ [UX-1.1-PROOF] type=branch id=branch.operations scope=trunk.avgol actions=focusView,showKPIs,showTimeboxes,showPressureSources,cycleClusterLevel,focusNextRegion,loadGlobalCore
20:02:13.562 ℹ️ [UX-1.1-PROOF] type=sheet id=sheet.packaging scope=branch.operations actions=focusView,showSchema,addColumn,addValidation,addSummaryBinding
20:02:13.562 ℹ️ [UX-1.1-PROOF] type=cell id=sheet.packaging.cell.0.0 scope=branch.operations actions=edit,viewDependencies,viewHistory,createValidation,lockScope
20:02:13.562 ℹ️ [UX-1.1-PROOF] type=match id=3WM-001 scope=branch.p2p.mc1 actions=inspectSources,viewVariance,setTolerance,markResolved
20:02:13.563 ℹ️ [UX-1.1-PROOF] type=route id=p2p.requisition scope=branch.p2p.fc1 actions=previewMapping,ingestTestRecord,showProvenance,editFieldMap
20:02:13.563 ℹ️ [UX-1.1-PROOF] type=module id=P2P scope=trunk.avgol actions=showAllSheets,showRoutes,showKPIBindings,showRecomputationChain
20:02:13.563 ℹ️ [UX-1.1] Universal Object Contract: 7 types resolved
20:02:13.564 ℹ️ [PRESENCE] engine enabled=PASS ttlMs=15000 hbMs=3000
[PRESENCE] engine enabled=PASS ttlMs=15000 hbMs=3000
20:02:13.564 ℹ️ [PRESENCE] room resolve scope=trunk.avgol roomId=room.111ef3ac result=PASS
[PRESENCE] room resolve scope=trunk.avgol roomId=room.111ef3ac result=PASS
20:02:13.564 ℹ️ [PRESENCE] join user=user.local.mlsgkqm4 room=room.111ef3ac members=1 result=PASS
[PRESENCE] join user=user.local.mlsgkqm4 room=room.111ef3ac members=1 result=PASS
20:02:13.565 ℹ️ [VIS8] renderEngine enabled=PASS topology=mesh sfuReady=true
[VIS8] renderEngine enabled=PASS topology=mesh sfuReady=true
20:02:13.566 ℹ️ [VIS8] rtc join user=user.local.mlsgkqm4 room=room.111ef3ac peers=0 result=PASS
[VIS8] rtc join user=user.local.mlsgkqm4 room=room.111ef3ac peers=0 result=PASS
20:02:13.566 ℹ️ [PRESENCE] bind deferred=PASS reason=scopeNotReady
[PRESENCE] bind deferred=PASS reason=scopeNotReady
20:02:13.567 ℹ️ [VIS8] budget decode active=1 max=2 lod=COMPANY
[VIS8] budget decode active=1 max=2 lod=COMPANY
20:02:13.567 ℹ️ [VIS8] budget render active=1 max=4 lod=COMPANY
[VIS8] budget render active=1 max=4 lod=COMPANY
20:02:13.567 ℹ️ [VIS8] lodSwitch user=user.local.mlsgkqm4 from=dot to=billboard trigger=scope
[VIS8] lodSwitch user=user.local.mlsgkqm4 from=dot to=billboard trigger=scope
20:02:13.567 ℹ️ [VIS8] renderCard user=user.local.mlsgkqm4 lod=billboard video=off reason=consent
[VIS8] renderCard user=user.local.mlsgkqm4 lod=billboard video=off reason=consent
[CRYPTO] chainInit global=PASS genesisHash=GENESIS commits=0
20:02:13.568 ℹ️ [CAM] basin-proximity target=branch.maintenance type=branch radiusM=6000.0 distanceM=1584.3 assist=BLOCKED_LAUNCH
20:02:13.571 ℹ️ [VIS] sheetSelect resolved sheet=MFG.MaterialIssues reason=default
[VIS] sheetSelect resolved sheet=MFG.MaterialIssues reason=default
20:02:13.572 ℹ️ [VIS] enter sheet=MFG.MaterialIssues scope=sheet-only
[VIS] enter sheet=MFG.MaterialIssues scope=sheet-only
20:02:13.572 ℹ️ [DOCK] enterSheet target=MFG.MaterialIssues mode=FaceOn result=PASS distM=1196
20:02:13.572 ℹ️ [CAM] Face-on: instant snap (duration=0 method=setView)
20:02:13.572 ℹ️ [LOD] apply level=CELL sheetsDetailed=1 lanes=1 markers=1
20:02:13.573 ℹ️ [DOCK] dist=105 align=-1.00 preview=true edit=false overlay=0.00
20:02:13.574 ℹ️ [DOCK] autoDock disabled=PASS reason=explicitEnter
[CRYPTO] chainInit sheets=PASS chains=0
[BoundaryRenderer] ✅ ARG: Loaded 1/1 features
[BoundaryRenderer] Loading GBR from data/boundaries/countries/GBR-ADM0.geojson
20:02:13.640 ℹ️ [GATE 4] Anchor marker rendered at (-122.4194, 37.7749) - independent of buildings/terrain
20:02:13.640 ℹ️ [GATE 4] Anchor marker rendered at (-0.1276, 51.5072) - independent of buildings/terrain
20:02:13.640 ℹ️ [GATE 4] Anchor marker rendered at (77.2090, 28.6139) - independent of buildings/terrain
20:02:13.641 ℹ️ [GATE 4] Anchor marker rendered at (139.6917, 35.6895) - independent of buildings/terrain
20:02:13.641 ℹ️ [GATE 4] Anchor marker rendered at (-46.6333, -23.5505) - independent of buildings/terrain
20:02:13.642 ℹ️ [GATE 4] Anchor marker rendered at (-122.4194, 37.7749) - independent of buildings/terrain
20:02:13.642 ℹ️ [GATE 4] Anchor marker rendered at (-118.2437, 34.0522) - independent of buildings/terrain
20:02:13.642 ℹ️ [GATE 4] Anchor marker rendered at (-97.7431, 30.2672) - independent of buildings/terrain
20:02:13.643 ℹ️ [GATE 4] Anchor marker rendered at (9.1900, 45.4642) - independent of buildings/terrain
20:02:13.643 ℹ️ [GATE 4] Anchor marker rendered at (12.4964, 41.9028) - independent of buildings/terrain
20:02:13.643 ℹ️ [GATE 4] Anchor marker rendered at (11.5820, 48.1351) - independent of buildings/terrain
20:02:13.644 ℹ️ [GATE 4] Anchor marker rendered at (139.6503, 35.6762) - independent of buildings/terrain
20:02:13.644 ℹ️ [GATE 4] Anchor marker rendered at (-46.6333, -23.5505) - independent of buildings/terrain
20:02:13.644 ℹ️ [GATE 4] Anchor marker rendered at (151.2093, -33.8688) - independent of buildings/terrain
20:02:13.645 ℹ️ [GATE 4] Anchor marker rendered at (-79.3832, 43.6532) - independent of buildings/terrain
20:02:13.651 ℹ️ [VIS2] expandedSheetsAllowed=true scope=sheet
20:02:13.651 ℹ️ [VIS2] suppressSheetDetail=false expandedSheetsAllowed=true selectedSheet=MFG.MaterialIssues lod=CELL
20:02:13.658 ℹ️ [VIS] sheetOnlyRender sheetsDetailed=1 selected=MFG.MaterialIssues hidden=38
20:02:13.666 ℹ️ [VIS2] sheetTilesRendered count=38
20:02:13.666 ℹ️ [VIS2] enterSheet expanded=1 tiles=38
20:02:13.666 ℹ️ [VIS3.2] sheetOverlay begin sheet=MFG.MaterialIssues scope=sheet
20:02:13.666 ℹ️ [VIS3.2] exceptionRows result=PASS sheet=MFG.MaterialIssues count=0
20:02:13.667 ℹ️ [VIS3.2] routeHighlights result=PASS sheet=MFG.MaterialIssues edges=0
20:02:13.667 ℹ️ [VIS3.2] budget exceptionOverlays=0 routeHighlights=0 capped=false
20:02:13.667 ℹ️ [VIS3.2] gate-summary result=PASS
20:02:13.667 ℹ️ [VIS4] sheetSlabGap enforced minGap=8m raw=2.5m effective=8.0m
20:02:13.667 ℹ️ [VIS4c] labelsRendered count=1 scope=sheet
20:02:13.667 ℹ️ [VIS4] slabsRendered scope=sheet objects=1 slabs=1 capped=false
20:02:13.667 ℹ️ [VIS4] sheetSlabs result=PASS sheet=MFG.MaterialIssues slabs=1
20:02:13.667 ℹ️ [VIS4] gate-summary result=PASS
20:02:13.667 ℹ️ [LOD-BUDGET] frame sheetsDetailed=1 totalMarkers=5 totalPrims=98 totalEntities=132
20:02:13.668 ℹ️ [CAM] dockFaceOn applied=PASS sheet=MFG.MaterialIssues
[2D] gridShown sheet=MFG.MaterialIssues rows=1 cols=5 populated=5 result=PASS
20:02:14.482 ℹ️ [VIS8] mediaPermissions cam=prompt mic=prompt
[VIS8] mediaPermissions cam=prompt mic=prompt
20:02:14.704 ℹ️ [HUD] paramsLoaded version=HUD-PARAMS-v0 policyRef=local:HUD-PARAMS-v0
[BoundaryRenderer] ✅ GBR: Loaded 1/1 features
[BoundaryRenderer] Loading FRA from data/boundaries/countries/FRA-ADM0.geojson
20:02:14.731 ℹ️ [DOCK] dist=105 align=1.00 preview=true edit=false overlay=0.95
20:02:15.195 ℹ️ [VIS] exit sheet=MFG.MaterialIssues restoreView=true
[VIS] exit sheet=MFG.MaterialIssues restoreView=true
[2D] gridHidden reason=exitSheet result=PASS
[VIS] exitSheet cleanup=PASS cleared=sheetId,anchor,selection,forceCompanyScope,explicitEnter,autoDockFlags
20:02:15.195 ℹ️ [VIS] enter company=trunk.avgol
[VIS] enter company=trunk.avgol
20:02:15.196 ℹ️ [LOD] apply level=COMPANY requestedSheetsDetailed=0 effectiveSheetsDetailed=0 lanes=0 markers=0 reason=collapsedByPolicy distKm=1.5
20:02:15.196 ℹ️ [CAM] focusLock target=trunk.avgol scope=company result=PASS
20:02:15.196 ℹ️ [INPUT] owner=CAMERA mode=FreeFly reason=focusLock
20:02:15.196 ℹ️ [LOD] lock level=COMPANY reason=basinFocus
20:02:15.197 ℹ️ [HUD] votes summary=PASS passed=4 pending=2 rejected=0
[HUD] votes summary=PASS passed=4 pending=2 rejected=0
20:02:15.213 ℹ️ [DOCK] assistBlocked policy=launch target=MFG.MaterialIssues dist=105 status="Dock assist blocked by launch policy"
20:02:15.245 ℹ️ [VIS2] expandedSheetsAllowed=false scope=company
20:02:15.245 ℹ️ [VIS2] suppressSheetDetail=true expandedSheetsAllowed=false selectedSheet=none lod=COMPANY
20:02:15.247 ℹ️ [VIS2] deptSpinesRendered count=8
20:02:15.247 ℹ️ [VIS2] companyCollapsed result=PASS sheetsRendered=0 lod=COMPANY scope=company expandedSheetsAllowed=false
20:02:15.251 ℹ️ [VIS2] sheetTilesRendered count=39
20:02:15.251 ℹ️ [VIS2] exitSheet collapsed=PASS expanded=0 tiles=39
20:02:15.252 ℹ️ [VIS3] flowOverlay result=PASS edges=66 exceptions=11 scope=company lod=COMPANY
20:02:15.252 ℹ️ [VIS3] trafficBarsRendered count=8
20:02:15.252 ℹ️ [VIS3] gate-summary result=PASS
20:02:15.258 ℹ️ [VIS4c] labelsRendered count=81 scope=company
20:02:15.258 ℹ️ [VIS4] slabsRendered scope=company objects=24 slabs=81 capped=false
20:02:15.259 ℹ️ [VIS4] companySlabs result=PASS deptBranches=8 trunkSlabs=51
20:02:15.259 ℹ️ [VIS4] gate-summary result=PASS
20:02:15.259 ℹ️ [LOD-BUDGET] frame sheetsDetailed=0 totalMarkers=0 totalPrims=185 totalEntities=202
[BoundaryRenderer] ✅ FRA: Loaded 1/1 features
[BoundaryRenderer] Loading DEU from data/boundaries/countries/DEU-ADM0.geojson
20:02:15.904 ℹ️ [DOCK] dist=557 align=0.02 preview=true edit=false overlay=0.00
WebSocket connection to 'ws://127.0.0.1:4031/vis8' failed: Error in connection establishment: net::ERR_CONNECTION_REFUSED
[REPLAY] start scope=sheet moduleId=none sheetId=sheet.packaging from=0 to=latest
20:02:16.164 ℹ️ [HUD] mode=CompanyFocus
20:02:16.452 ℹ️ [PRESENCE] transport degraded=PASS mode=local-only reason=wsConnectFailed
[PRESENCE] transport degraded=PASS mode=local-only reason=wsConnectFailed
Access to script at 'node:crypto' from origin 'http://127.0.0.1:3000' has been blocked by CORS policy: Cross origin requests are only supported for protocol schemes: chrome, chrome-untrusted, data, http, https.
Failed to load resource: net::ERR_FAILED
20:02:16.466 ℹ️ [CAM] basinFocus settled target=trunk.avgol distM=900 pitch=-55
[BoundaryRenderer] ✅ DEU: Loaded 1/1 features
[BoundaryRenderer] Loading NLD from data/boundaries/countries/NLD-ADM0.geojson
20:02:16.933 ℹ️ [PRESENCE] hb user=user.local.mlsgkqm4 room=room.111ef3ac ageMs=3369 result=PASS
[PRESENCE] hb user=user.local.mlsgkqm4 room=room.111ef3ac ageMs=3369 result=PASS
20:02:16.947 ℹ️ [DOCK] dist=761 align=0.05 preview=false edit=false overlay=0.00
[REPLAY] sheet sheetId=sheet.packaging commitCount=0 replayHash=44136fa355b3678a liveHash=44136fa355b3678a result=MATCH
[BoundaryRenderer] ✅ NLD: Loaded 1/1 features
[BoundaryRenderer] Loading EGY from data/boundaries/countries/EGY-ADM0.geojson
20:02:18.111 ℹ️ [DOCK] dist=761 align=0.05 preview=false edit=false overlay=0.00
[BoundaryRenderer] ✅ EGY: Loaded 1/1 features
[BoundaryRenderer] Loading SAU from data/boundaries/countries/SAU-ADM0.geojson
20:02:19.282 ℹ️ [DOCK] dist=761 align=0.05 preview=false edit=false overlay=0.00
[REPLAY] start scope=module moduleId=P2P from=0 to=latest
[BoundaryRenderer] ✅ SAU: Loaded 1/1 features
[BoundaryRenderer] Loading IND from data/boundaries/countries/IND-ADM0.geojson
[CRYPTO] merkleInit timeboxes=PASS count=6 rollingRoot=879d4f090ced7cd8
[CRYPTO] chainStamp mode=derived commits=0 sheets=0 timeboxes=6
20:02:20.042 ℹ️ [PRESENCE] hb user=user.local.mlsgkqm4 room=room.111ef3ac ageMs=3109 result=PASS
[PRESENCE] hb user=user.local.mlsgkqm4 room=room.111ef3ac ageMs=3109 result=PASS
20:02:20.308 ℹ️ [DOCK] dist=761 align=0.05 preview=false edit=false overlay=0.00
[BoundaryRenderer] ✅ IND: Loaded 1/1 features
[BoundaryRenderer] Loading CHN from data/boundaries/countries/CHN-ADM0.geojson
[BoundaryRenderer] ✅ CHN: Loaded 1/1 features
[BoundaryRenderer] Loading KOR from data/boundaries/countries/KOR-ADM0.geojson
20:02:21.377 ℹ️ [DOCK] dist=761 align=0.05 preview=false edit=false overlay=0.00
[REPLAY] golden-compare facts=M matches=M summaries=M kpis=M commits=M packets=M ledger=M
[REPLAY] timing ingest=0ms matches=0ms summaries=0ms kpis=0ms packets=0ms ledger=0ms hashCompare=1869ms total=1869ms
[REPLAY] module moduleId=P2P result=MATCH
[REPLAY] perf-gate count=35 totalMs=1869 threshold=60000 result=PASS
[BoundaryRenderer] ✅ KOR: Loaded 1/1 features
[BoundaryRenderer] Loading ISR from data/boundaries/countries/ISR-ADM0.geojson
20:02:22.465 ℹ️ [DOCK] dist=761 align=0.05 preview=false edit=false overlay=0.00
20:02:23.010 ℹ️ [PRESENCE] hb user=user.local.mlsgkqm4 room=room.111ef3ac ageMs=2968 result=PASS
[PRESENCE] hb user=user.local.mlsgkqm4 room=room.111ef3ac ageMs=2968 result=PASS
[BOUNDARY] reuse id=boundary-ISR-0-0050ba14
20:02:23.018 ℹ️ [GLOBE] country-set id=global-core loaded=26
[BoundaryRenderer] Loading USA from data/boundaries/countries/USA-ADM0.geojson
20:02:23.547 ℹ️ [DOCK] dist=761 align=0.05 preview=false edit=false overlay=0.00
[BoundaryRenderer] Loading USA from data/boundaries/countries/USA-ADM0.geojson
20:02:24.646 ℹ️ [DOCK] dist=761 align=0.05 preview=false edit=false overlay=0.00
20:02:25.139 ℹ️ [GLOBE] focus country=USA
20:02:25.139 ℹ️ [GLOBE] focus region=north-america
20:02:25.139 ℹ️ [GLOBE] hierarchy init cluster=globe countries=11
[BoundaryRenderer] Loading USA from data/boundaries/countries/USA-ADM0.geojson
20:02:25.370 ℹ️ [CAM] basin-exit target=branch.maintenance
20:02:25.920 ℹ️ [PRESENCE] hb user=user.local.mlsgkqm4 room=room.111ef3ac ageMs=2910 result=PASS
[PRESENCE] hb user=user.local.mlsgkqm4 room=room.111ef3ac ageMs=2910 result=PASS
20:02:25.966 ℹ️ [DOCK] dist=22926680 align=0.31 preview=false edit=false overlay=0.00
[BoundaryRenderer] Loading ISR from data/boundaries/countries/ISR-ADM0.geojson
20:02:27.051 ℹ️ [GLOBE] country-set id=global-core loaded=26
20:02:27.051 ℹ️ [GLOBE] cluster level=globe focusCountry=USA
20:02:27.062 ℹ️ [DOCK] dist=24611023 align=0.33 preview=false edit=false overlay=0.00
20:02:28.256 ℹ️ [DOCK] dist=24611023 align=0.33 preview=false edit=false overlay=0.00
20:02:29.000 ℹ️ [PRESENCE] hb user=user.local.mlsgkqm4 room=room.111ef3ac ageMs=3080 result=PASS
[PRESENCE] hb user=user.local.mlsgkqm4 room=room.111ef3ac ageMs=3080 result=PASS
20:02:29.525 ℹ️ [DOCK] dist=24611023 align=0.33 preview=false edit=false overlay=0.00
[CRYPTO] verify scope=full global=VALID sheets=VALID merkle=VALID rolling=VALID overall=VALID emitScar=false durationMs=5935
[CRYPTO] replayPreCheck result=PASS durationMs=5935
[REPLAY] start scope=module moduleId=P2P from=0 to=5
20:02:30.539 ℹ️ [DOCK] dist=24611023 align=0.33 preview=false edit=false overlay=0.00
20:02:31.572 ℹ️ [DOCK] dist=24611023 align=0.33 preview=false edit=false overlay=0.00
[REPLAY] golden-compare facts=M matches=M summaries=M kpis=M commits=M packets=M ledger=M
[REPLAY] timing ingest=0ms matches=0ms summaries=0ms kpis=0ms packets=0ms ledger=0ms hashCompare=1820ms total=1820ms
[REPLAY] module moduleId=P2P result=MATCH
[REPLAY] perf-gate count=35 totalMs=1820 threshold=60000 result=PASS
20:02:32.095 ℹ️ [PRESENCE] hb user=user.local.mlsgkqm4 room=room.111ef3ac ageMs=3095 result=PASS
[PRESENCE] hb user=user.local.mlsgkqm4 room=room.111ef3ac ageMs=3095 result=PASS
20:02:32.637 ℹ️ [DOCK] dist=24611023 align=0.33 preview=false edit=false overlay=0.00
20:02:33.644 ℹ️ [DOCK] dist=24611023 align=0.33 preview=false edit=false overlay=0.00
[REPLAY] divergenceDebug allSheets=39 factSheets=0 factIds=
[REPLAY] divergenceTest mutationApplied=true
20:02:34.657 ℹ️ [DOCK] dist=24611023 align=0.33 preview=false edit=false overlay=0.00
20:02:34.885 ℹ️ [PRESENCE] hb user=user.local.mlsgkqm4 room=room.111ef3ac ageMs=2790 result=PASS
[PRESENCE] hb user=user.local.mlsgkqm4 room=room.111ef3ac ageMs=2790 result=PASS
[REPLAY] divergenceCheck baseline.facts=4f53cda18c2b mutated.facts=d1c5fbc4a78d changed=true
20:02:35.678 ℹ️ [DOCK] dist=24611023 align=0.33 preview=false edit=false overlay=0.00
20:02:36.699 ℹ️ [DOCK] dist=24611023 align=0.33 preview=false edit=false overlay=0.00
20:02:37.715 ℹ️ [DOCK] dist=24611023 align=0.33 preview=false edit=false overlay=0.00
20:02:37.943 ℹ️ [PRESENCE] hb user=user.local.mlsgkqm4 room=room.111ef3ac ageMs=3058 result=PASS
[PRESENCE] hb user=user.local.mlsgkqm4 room=room.111ef3ac ageMs=3058 result=PASS
20:02:38.903 ℹ️ [DOCK] dist=24611023 align=0.33 preview=false edit=false overlay=0.00
20:02:40.131 ℹ️ [DOCK] dist=24611023 align=0.33 preview=false edit=false overlay=0.00
20:02:40.865 ℹ️ [PRESENCE] hb user=user.local.mlsgkqm4 room=room.111ef3ac ageMs=2922 result=PASS
[PRESENCE] hb user=user.local.mlsgkqm4 room=room.111ef3ac ageMs=2922 result=PASS
20:02:41.171 ℹ️ [DOCK] dist=24611023 align=0.33 preview=false edit=false overlay=0.00
[CRYPTO] verify scope=full global=VALID sheets=VALID merkle=VALID rolling=VALID overall=VALID emitScar=false durationMs=5739
[CRYPTO] replayPreCheck result=PASS durationMs=5739
[REPLAY] start scope=module moduleId=P2P from=0 to=latest
20:02:42.377 ℹ️ [DOCK] dist=24611023 align=0.33 preview=false edit=false overlay=0.00
[REPLAY] golden-compare facts=D matches=D summaries=D kpis=M commits=M packets=M ledger=M
[REPLAY] timing ingest=0ms matches=0ms summaries=0ms kpis=0ms packets=0ms ledger=0ms hashCompare=1711ms total=1711ms
[REPLAY] module moduleId=P2P result=DIVERGENCE
20:02:43.119 ℹ️ [REFUSAL] reason=REPLAY_DIVERGENCE component=facts expected=4f53cda18c2baa0c actual=d1c5fbc4a78d6e01 moduleId=P2P commitRange=0-latest
[REFUSAL] reason=REPLAY_DIVERGENCE component=facts expected=4f53cda18c2baa0c actual=d1c5fbc4a78d6e01 moduleId=P2P commitRange=0-latest
[TIMEBOX] event type=REPLAY_DIVERGENCE id=REPLAY_DIVERGENCE applied=PASS target=trunk.avgol timeboxId=T6
20:02:43.120 ℹ️ [REFUSAL] reason=REPLAY_DIVERGENCE component=matches expected=4f53cda18c2baa0c actual=cf7d23ac7726da26 moduleId=P2P commitRange=0-latest
[REFUSAL] reason=REPLAY_DIVERGENCE component=matches expected=4f53cda18c2baa0c actual=cf7d23ac7726da26 moduleId=P2P commitRange=0-latest
[TIMEBOX] event type=REPLAY_DIVERGENCE id=REPLAY_DIVERGENCE applied=PASS target=trunk.avgol timeboxId=T6
20:02:43.120 ℹ️ [REFUSAL] reason=REPLAY_DIVERGENCE component=summaries expected=c7e8aee97a4a1c50 actual=403fc36afb332b4d moduleId=P2P commitRange=0-latest
[REFUSAL] reason=REPLAY_DIVERGENCE component=summaries expected=c7e8aee97a4a1c50 actual=403fc36afb332b4d moduleId=P2P commitRange=0-latest
[TIMEBOX] event type=REPLAY_DIVERGENCE id=REPLAY_DIVERGENCE applied=PASS target=trunk.avgol timeboxId=T6
[REPLAY] perf-gate count=35 totalMs=1711 threshold=60000 result=PASS
[REPLAY] divergenceTest mutationApplied=true mutationReverted=true result=PASS
20:02:43.394 ℹ️ [DOCK] dist=24611023 align=0.33 preview=false edit=false overlay=0.00
[ENU] Coordinate system loaded - all geometry in meters
[HEADLESS] mode=FORCED reason=urlParam
20:02:44.468 ℹ️ [GLOBE] imagery mode=osm provider=OpenStreetMap
20:02:44.473 ℹ️ [PRES] colorCorrection added=PASS vignette=ON coolTone=ON
20:02:44.473 ℹ️ [PRES] postFX enabled=PASS fxaa=ON bloom=ON colorCorrect=ON
20:02:44.474 ℹ️ [PRES] fog enabled=PASS density=0.00048
20:02:44.476 ⚠️ ⚠️ Buildings marked as DEGRADED
20:02:44.477 ℹ️ [LAUNCH-FIX] basemapDim brightness=0.28 contrast=0.55 saturation=0.05 gamma=1.6 applied=PASS
20:02:44.477 ℹ️ [LAUNCH] visibilityMode enabled=PASS scale=0.25 trunkPrimitive=cylinder widthFloors=ON basemapDimming=ON
20:02:44.478 ℹ️ [PRES] environmentDeemphasis applied=PASS brightness=0.28 saturation=0.05 gamma=1.6
20:02:44.478 ℹ️ [GLOBE] services weatherBase=http://127.0.0.1:4020
20:02:44.478 ℹ️ [GLOBE] imagery registry enabled modes=local,clean-street,satellite,hybrid,osm,dark,minimalist
20:02:44.479 ℹ️ [CAM] restore-POV skipped for launch (deterministic frame)
20:02:44.480 ℹ️ [INPUT] owner=CAMERA mode=FreeFly reason=default
[RelationshipRenderer] Initialized
[RelationshipRenderer] Cleared all relationships
[BoundaryRenderer] DataSource created and added to viewer
[BoundaryRenderer] Initialized
[BoundaryRenderer] Loading ISR from data/boundaries/countries/ISR-ADM0.geojson
[BoundaryRenderer] Loading USA from data/boundaries/countries/USA-ADM0.geojson
20:02:44.482 ℹ️ [BOUNDARY-EDITOR] Initialized
[FILAMENT] registry initialized=PASS total=6
[DISCLOSURE] restore backend=localStorage loaded=6 result=PASS
[GroupMarkerNotSet(crbug.com/242999)!:A0F0230004460000]Automatic fallback to software WebGL has been deprecated. Please use the --enable-unsafe-swiftshader (about:flags#enable-unsafe-swiftshader) flag to opt in to lower security guarantees for trusted content.
[BoundaryRenderer] ✅ ISR: Loaded 1/1 features
[BoundaryRenderer] ✅ USA: Loaded 1/1 features
20:02:45.234 ℹ️ [BOUNDARY] containsll suite=PASS polygons=1 multipolygons=1 holes=0
20:02:45.234 ℹ️ [BOUNDARY] containsll hole-suite=PASS probes=3
20:02:45.235 ℹ️ [BOUNDARY] restore result=PASS renderer=BoundaryRenderer containsLL=PASS ISR=1 USA=1
20:02:45.235 ℹ️ [GATE] G3 status=PASS evidence=runtime-boundary-selftest
20:02:45.235 ℹ️ [UX] boundaries=ACTIVE mode=READ_ONLY
20:02:45.235 ℹ️ [BOUNDARY] voting-scope mode=BOUNDARY_ENABLED reason=boundary-pass
20:02:45.646 ℹ️ [BOUNDARY] manifestLoaded countries=27
[BoundaryRenderer] Loading USA from data/boundaries/countries/USA-ADM0.geojson
[BOUNDARY] reuse id=boundary-USA-0-6c62914d
[BoundaryRenderer] Loading BRA from data/boundaries/countries/BRA-ADM0.geojson
20:02:46.792 ℹ️ [VOTE] restore backend=localStorage mode=demo loaded=0 result=PASS
[VOTE] restore backend=localStorage mode=demo loaded=0 result=PASS
[BACKING] id=branch.finance filaments=3 timeboxes=7 evidence=0 missing=0
[CONF] id=branch.finance conf=0.40 breakdown=tb:1,ev:0,disc:1,vote:0
[ATTN] id=branch.finance attn=0.20 lifecycle=SETTLING disclosure=WITNESSED vote=PENDING
[BACKING] id=branch.maintenance filaments=3 timeboxes=7 evidence=0 missing=0
[CONF] id=branch.maintenance conf=0.40 breakdown=tb:1,ev:0,disc:1,vote:0
[ATTN] id=branch.maintenance attn=0.36 lifecycle=REFUSAL disclosure=PUBLIC_SUMMARY vote=PENDING
[AC] aggregateAttention scope=company result=0.36 children=8
[AC] aggregateConfidence scope=company result=0.35 children=8
[AC] initialized=PASS functions=5 filaments=6
20:02:46.810 ℹ️ [PRES] launchTransform scale=0.25 uOffset=0 applied=PASS
20:02:46.812 ℹ️ [LAUNCH-FIX] visualHierarchy applied=PASS tilesAlpha=0.018 trunkCore=0.96 branchAlpha=0.18
20:02:46.812 ℹ️ [LAUNCH-THEME] tokens loaded trunk=thinPillar tile=horizontalPlatform filament=rain
20:02:46.812 ℹ️ [GATE] launchVisibility semantics=UNCHANGED enuChecks=RAW
20:02:46.812 ℹ️ [LAUNCH] widthFloors trunk=20m branches=13/10/6 tiles=90x52m rule=uniform
20:02:46.813 ℹ️ [PRES] trunkStyle applied=PASS mode=core+shell coreR=12 shellR=20
20:02:46.813 ℹ️ [PRES] branchStyle applied=PASS ribMode=ON ribScale=0.18 emissive=ON alpha=0.18
20:02:46.813 ℹ️ [PRES] sheetPlatform grid=PASS majorLines=16 mode=overview normal=UP horizontal=ON landscape=120x70
20:02:46.814 ℹ️ [PRES] tileFloatMode=PASS supportFilaments=ON fillAlpha=0.018 borderAlpha=1.0
20:02:46.814 ℹ️ [PRES] filamentRain enabled=PASS density=2
20:02:46.814 ℹ️ [PRES] rootGlow enabled=PASS radius=80 alpha=0.10
20:02:46.815 ℹ️ [GATE 4] Anchor marker rendered at (34.7818, 32.0853) - independent of buildings/terrain
20:02:46.818 ℹ️ [PRES] tether rendered=PASS
20:02:46.819 ℹ️ [PRES] buildingAnchorProxy rendered=PASS reason=buildings-degraded
20:02:46.819 ℹ️ [GATE 4] Anchor marker rendered at (34.7818, 32.0853) - independent of buildings/terrain
20:02:46.820 ℹ️ [GATE 4] Anchor marker rendered at (34.7818, 32.0853) - independent of buildings/terrain
20:02:46.821 ℹ️ [GATE 4] Anchor marker rendered at (34.7818, 32.0853) - independent of buildings/terrain
20:02:46.822 ℹ️ [GATE 4] Anchor marker rendered at (34.7818, 32.0853) - independent of buildings/terrain
20:02:46.823 ℹ️ [GATE 4] Anchor marker rendered at (34.7818, 32.0853) - independent of buildings/terrain
20:02:46.823 ℹ️ [VIS] voteFilter LOD=COMPANY override=ALL
20:02:46.829 ℹ️ [UX] debugLogs=false gateSpamSuppressed=true
20:02:46.835 ℹ️ [PRES] junctions rendered=PASS count=8
20:02:46.835 ℹ️ [VIS2] expandedSheetsAllowed=false scope=world
20:02:46.836 ℹ️ [VIS2] suppressSheetDetail=true expandedSheetsAllowed=false selectedSheet=none lod=COMPANY
20:02:46.837 ℹ️ [VIS-LAUNCH] ringContainment mode=collapsed action=suppressNonFocused result=PASS
[FILAMENT] bandSnap id=FIL-001 timeboxId=FIN-T4 deltaM=0 result=PASS
[FILAMENT] bandSnap id=FIL-002 timeboxId=FIN-T3 deltaM=0 result=PASS
[FILAMENT] bandSnap id=FIL-003 timeboxId=FIN-T1 deltaM=0 result=PASS
[FILAMENT] bandSnap id=FIL-004 timeboxId=MNT-T0 deltaM=0 result=PASS
[FILAMENT] bandSnap id=FIL-006 timeboxId=MNT-T1 deltaM=0 result=PASS
[FILAMENT] bandSnap source=vis4Registry
[DISCLOSURE] markersRendered count=5 tiers={PRIVATE:2,WITNESSED:2,PUBLIC_SUMMARY:1,FULL_PUBLIC:0}
20:02:46.838 ℹ️ [VIS2] deptSpinesRendered count=8
20:02:46.838 ℹ️ [VIS2] companyCollapsed result=PASS sheetsRendered=0 lod=COMPANY scope=world expandedSheetsAllowed=false
20:02:46.844 ℹ️ [VIS2] sheetTilesRendered count=39
20:02:46.846 ℹ️ [VIS2] exitSheet collapsed=PASS expanded=0 tiles=39
20:02:46.848 ℹ️ [VIS3] flowOverlay result=PASS edges=66 exceptions=11 scope=world lod=COMPANY
20:02:46.848 ℹ️ [VIS3] trafficBarsRendered count=8
20:02:46.849 ℹ️ [VIS3] gate-summary result=PASS
20:02:46.852 ℹ️ [VIS4c] labelsRendered count=36 scope=company
20:02:46.852 ℹ️ [VIS4] slabsRendered scope=company objects=9 slabs=36 capped=false
20:02:46.853 ℹ️ [VIS4] companySlabs result=PASS deptBranches=8 trunkSlabs=6
20:02:46.853 ℹ️ [VIS4] gate-summary result=PASS
20:02:46.853 ℹ️ [LOD-BUDGET] frame sheetsDetailed=0 totalMarkers=0 totalPrims=125 totalEntities=97
[BoundaryRenderer] ✅ BRA: Loaded 1/1 features
[BoundaryRenderer] Loading ARG from data/boundaries/countries/ARG-ADM0.geojson
[BoundaryRenderer] ✅ ARG: Loaded 1/1 features
[BoundaryRenderer] Loading GBR from data/boundaries/countries/GBR-ADM0.geojson
20:02:49.020 ℹ️ [GLOBE] worldTrunks synced added=15 total=16
20:02:49.021 ℹ️ [GLOBE] datasetLoad anchors=6
20:02:49.022 ℹ️ [UX] multiCountrySmoke=PASS anchors=6
20:02:49.023 ℹ️ [LAUNCH-FIX] cameraFrame target=trunk.avgol result=PASS distM=750 horzM=1000 heading=355 pitch=-28 applied=PASS
20:02:49.025 ℹ️ [HUD] mode=FreeFly layer1=6 layer2=0
20:02:49.032 ℹ️ [HUD] consolidated rootCount=1 duplicates=0
20:02:49.038 ℹ️ [HUD] tier1 rows=6
20:02:49.039 ℹ️ [HUD] tier2 default=collapsed
20:02:49.039 ℹ️ [PRES] billboard=ON reason=launch-default
20:02:49.041 ℹ️ [UX] debugLogs=false (launch mode)
20:02:49.041 ℹ️ [LAUNCH-FIX] uiGating launch=true hiddenPanels=artifacts,ux3,p2p,topicLane,vote,workMode,logConsole applied=PASS
20:02:49.048 ℹ️ [LAUNCH-FIX] hud tier1=ON tier2=OFF default=collapsed
20:02:49.049 ℹ️ [LAUNCH-FIX] helpOverlay shown=true dismissed=false source=first
[BUILD] 2026-02-09T12:30Z ux-1.1-universal-object-contract
20:02:49.050 ℹ️ [UX-1.1-PROOF] type=trunk id=trunk.avgol scope=root actions=focusView,showKPIs,showTimeboxes,showBranches,cycleClusterLevel,focusNextRegion,loadGlobalCore
20:02:49.052 ℹ️ [UX-1.1-PROOF] type=branch id=branch.operations scope=trunk.avgol actions=focusView,showKPIs,showTimeboxes,showPressureSources,cycleClusterLevel,focusNextRegion,loadGlobalCore
20:02:49.052 ℹ️ [UX-1.1-PROOF] type=sheet id=sheet.packaging scope=branch.operations actions=focusView,showSchema,addColumn,addValidation,addSummaryBinding
20:02:49.052 ℹ️ [UX-1.1-PROOF] type=cell id=sheet.packaging.cell.0.0 scope=branch.operations actions=edit,viewDependencies,viewHistory,createValidation,lockScope
20:02:49.053 ℹ️ [UX-1.1-PROOF] type=match id=3WM-001 scope=branch.p2p.mc1 actions=inspectSources,viewVariance,setTolerance,markResolved
20:02:49.053 ℹ️ [UX-1.1-PROOF] type=route id=p2p.requisition scope=branch.p2p.fc1 actions=previewMapping,ingestTestRecord,showProvenance,editFieldMap
20:02:49.053 ℹ️ [UX-1.1-PROOF] type=module id=P2P scope=trunk.avgol actions=showAllSheets,showRoutes,showKPIBindings,showRecomputationChain
20:02:49.053 ℹ️ [UX-1.1] Universal Object Contract: 7 types resolved
20:02:49.054 ℹ️ [PRESENCE] engine enabled=PASS ttlMs=15000 hbMs=3000
[PRESENCE] engine enabled=PASS ttlMs=15000 hbMs=3000
20:02:49.055 ℹ️ [PRESENCE] room resolve scope=trunk.avgol roomId=room.111ef3ac result=PASS
[PRESENCE] room resolve scope=trunk.avgol roomId=room.111ef3ac result=PASS
20:02:49.055 ℹ️ [PRESENCE] join user=user.local.mlsglhzy room=room.111ef3ac members=1 result=PASS
[PRESENCE] join user=user.local.mlsglhzy room=room.111ef3ac members=1 result=PASS
20:02:49.057 ℹ️ [VIS8] renderEngine enabled=PASS topology=mesh sfuReady=true
[VIS8] renderEngine enabled=PASS topology=mesh sfuReady=true
20:02:49.058 ℹ️ [VIS8] rtc join user=user.local.mlsglhzy room=room.111ef3ac peers=0 result=PASS
[VIS8] rtc join user=user.local.mlsglhzy room=room.111ef3ac peers=0 result=PASS
20:02:49.059 ℹ️ [PRESENCE] bind deferred=PASS reason=scopeNotReady
[PRESENCE] bind deferred=PASS reason=scopeNotReady
20:02:49.059 ℹ️ [VIS8] budget decode active=1 max=2 lod=COMPANY
[VIS8] budget decode active=1 max=2 lod=COMPANY
20:02:49.059 ℹ️ [VIS8] budget render active=1 max=4 lod=COMPANY
[VIS8] budget render active=1 max=4 lod=COMPANY
20:02:49.060 ℹ️ [VIS8] lodSwitch user=user.local.mlsglhzy from=dot to=billboard trigger=scope
[VIS8] lodSwitch user=user.local.mlsglhzy from=dot to=billboard trigger=scope
20:02:49.060 ℹ️ [VIS8] renderCard user=user.local.mlsglhzy lod=billboard video=off reason=consent
[VIS8] renderCard user=user.local.mlsglhzy lod=billboard video=off reason=consent
[CRYPTO] chainInit global=PASS genesisHash=GENESIS commits=0
20:02:49.062 ℹ️ [CAM] basin-proximity target=branch.maintenance type=branch radiusM=6000.0 distanceM=1584.3 assist=BLOCKED_LAUNCH
20:02:49.067 ℹ️ [VIS] sheetSelect resolved sheet=MFG.MaterialIssues reason=default
[VIS] sheetSelect resolved sheet=MFG.MaterialIssues reason=default
20:02:49.068 ℹ️ [VIS] enter sheet=MFG.MaterialIssues scope=sheet-only
[VIS] enter sheet=MFG.MaterialIssues scope=sheet-only
20:02:49.068 ℹ️ [DOCK] enterSheet target=MFG.MaterialIssues mode=FaceOn result=PASS distM=1196
20:02:49.068 ℹ️ [CAM] Face-on: instant snap (duration=0 method=setView)
20:02:49.069 ℹ️ [LOD] apply level=CELL sheetsDetailed=1 lanes=1 markers=1
20:02:49.070 ℹ️ [DOCK] dist=105 align=-1.00 preview=true edit=false overlay=0.00
20:02:49.071 ℹ️ [DOCK] autoDock disabled=PASS reason=explicitEnter
[CRYPTO] chainInit sheets=PASS chains=0
20:02:49.150 ℹ️ [GATE 4] Anchor marker rendered at (-122.4194, 37.7749) - independent of buildings/terrain
20:02:49.151 ℹ️ [GATE 4] Anchor marker rendered at (-0.1276, 51.5072) - independent of buildings/terrain
20:02:49.152 ℹ️ [GATE 4] Anchor marker rendered at (77.2090, 28.6139) - independent of buildings/terrain
20:02:49.152 ℹ️ [GATE 4] Anchor marker rendered at (139.6917, 35.6895) - independent of buildings/terrain
20:02:49.153 ℹ️ [GATE 4] Anchor marker rendered at (-46.6333, -23.5505) - independent of buildings/terrain
20:02:49.153 ℹ️ [GATE 4] Anchor marker rendered at (-122.4194, 37.7749) - independent of buildings/terrain
20:02:49.154 ℹ️ [GATE 4] Anchor marker rendered at (-118.2437, 34.0522) - independent of buildings/terrain
20:02:49.156 ℹ️ [GATE 4] Anchor marker rendered at (-97.7431, 30.2672) - independent of buildings/terrain
20:02:49.156 ℹ️ [GATE 4] Anchor marker rendered at (9.1900, 45.4642) - independent of buildings/terrain
20:02:49.157 ℹ️ [GATE 4] Anchor marker rendered at (12.4964, 41.9028) - independent of buildings/terrain
20:02:49.157 ℹ️ [GATE 4] Anchor marker rendered at (11.5820, 48.1351) - independent of buildings/terrain
20:02:49.158 ℹ️ [GATE 4] Anchor marker rendered at (139.6503, 35.6762) - independent of buildings/terrain
20:02:49.158 ℹ️ [GATE 4] Anchor marker rendered at (-46.6333, -23.5505) - independent of buildings/terrain
20:02:49.159 ℹ️ [GATE 4] Anchor marker rendered at (151.2093, -33.8688) - independent of buildings/terrain
20:02:49.159 ℹ️ [GATE 4] Anchor marker rendered at (-79.3832, 43.6532) - independent of buildings/terrain
20:02:49.165 ℹ️ [VIS2] expandedSheetsAllowed=true scope=sheet
20:02:49.165 ℹ️ [VIS2] suppressSheetDetail=false expandedSheetsAllowed=true selectedSheet=MFG.MaterialIssues lod=CELL
20:02:49.170 ℹ️ [VIS] sheetOnlyRender sheetsDetailed=1 selected=MFG.MaterialIssues hidden=38
20:02:49.184 ℹ️ [VIS2] sheetTilesRendered count=38
20:02:49.184 ℹ️ [VIS2] enterSheet expanded=1 tiles=38
20:02:49.185 ℹ️ [VIS3.2] sheetOverlay begin sheet=MFG.MaterialIssues scope=sheet
20:02:49.185 ℹ️ [VIS3.2] exceptionRows result=PASS sheet=MFG.MaterialIssues count=0
20:02:49.185 ℹ️ [VIS3.2] routeHighlights result=PASS sheet=MFG.MaterialIssues edges=0
20:02:49.185 ℹ️ [VIS3.2] budget exceptionOverlays=0 routeHighlights=0 capped=false
20:02:49.185 ℹ️ [VIS3.2] gate-summary result=PASS
20:02:49.185 ℹ️ [VIS4] sheetSlabGap enforced minGap=8m raw=2.5m effective=8.0m
20:02:49.185 ℹ️ [VIS4c] labelsRendered count=1 scope=sheet
20:02:49.185 ℹ️ [VIS4] slabsRendered scope=sheet objects=1 slabs=1 capped=false
20:02:49.185 ℹ️ [VIS4] sheetSlabs result=PASS sheet=MFG.MaterialIssues slabs=1
20:02:49.185 ℹ️ [VIS4] gate-summary result=PASS
20:02:49.185 ℹ️ [LOD-BUDGET] frame sheetsDetailed=1 totalMarkers=5 totalPrims=98 totalEntities=132
20:02:49.186 ℹ️ [CAM] dockFaceOn applied=PASS sheet=MFG.MaterialIssues
[2D] gridShown sheet=MFG.MaterialIssues rows=1 cols=5 populated=5 result=PASS
20:02:50.027 ℹ️ [VIS8] mediaPermissions cam=prompt mic=prompt
[VIS8] mediaPermissions cam=prompt mic=prompt
[BoundaryRenderer] ✅ GBR: Loaded 1/1 features
[BoundaryRenderer] Loading FRA from data/boundaries/countries/FRA-ADM0.geojson
20:02:50.280 ℹ️ [HUD] paramsLoaded version=HUD-PARAMS-v0 policyRef=local:HUD-PARAMS-v0
20:02:50.299 ℹ️ [DOCK] dist=105 align=1.00 preview=true edit=false overlay=0.95
20:02:50.899 ℹ️ [VIS] exit sheet=MFG.MaterialIssues restoreView=true
[VIS] exit sheet=MFG.MaterialIssues restoreView=true
[2D] gridHidden reason=exitSheet result=PASS
[VIS] exitSheet cleanup=PASS cleared=sheetId,anchor,selection,forceCompanyScope,explicitEnter,autoDockFlags
20:02:50.899 ℹ️ [VIS] enter company=trunk.avgol
[VIS] enter company=trunk.avgol
20:02:50.900 ℹ️ [LOD] apply level=COMPANY requestedSheetsDetailed=0 effectiveSheetsDetailed=0 lanes=0 markers=0 reason=collapsedByPolicy distKm=1.5
20:02:50.900 ℹ️ [CAM] focusLock target=trunk.avgol scope=company result=PASS
20:02:50.901 ℹ️ [INPUT] owner=CAMERA mode=FreeFly reason=focusLock
20:02:50.901 ℹ️ [LOD] lock level=COMPANY reason=basinFocus
20:02:50.902 ℹ️ [HUD] votes summary=PASS passed=4 pending=2 rejected=0
[HUD] votes summary=PASS passed=4 pending=2 rejected=0
20:02:50.930 ℹ️ [DOCK] assistBlocked policy=launch target=MFG.MaterialIssues dist=105 status="Dock assist blocked by launch policy"
20:02:50.966 ℹ️ [VIS2] expandedSheetsAllowed=false scope=company
20:02:50.966 ℹ️ [VIS2] suppressSheetDetail=true expandedSheetsAllowed=false selectedSheet=none lod=COMPANY
20:02:50.968 ℹ️ [VIS2] deptSpinesRendered count=8
20:02:50.968 ℹ️ [VIS2] companyCollapsed result=PASS sheetsRendered=0 lod=COMPANY scope=company expandedSheetsAllowed=false
20:02:50.973 ℹ️ [VIS2] sheetTilesRendered count=39
20:02:50.973 ℹ️ [VIS2] exitSheet collapsed=PASS expanded=0 tiles=39
20:02:50.974 ℹ️ [VIS3] flowOverlay result=PASS edges=66 exceptions=11 scope=company lod=COMPANY
20:02:50.974 ℹ️ [VIS3] trafficBarsRendered count=8
20:02:50.974 ℹ️ [VIS3] gate-summary result=PASS
20:02:50.977 ℹ️ [VIS4c] labelsRendered count=81 scope=company
20:02:50.977 ℹ️ [VIS4] slabsRendered scope=company objects=24 slabs=81 capped=false
20:02:50.977 ℹ️ [VIS4] companySlabs result=PASS deptBranches=8 trunkSlabs=51
20:02:50.977 ℹ️ [VIS4] gate-summary result=PASS
20:02:50.978 ℹ️ [LOD-BUDGET] frame sheetsDetailed=0 totalMarkers=0 totalPrims=185 totalEntities=202