[E3-REPLAY-1-PROOF] stage=1 label=boot-regressions result=PASS
[E3-REPLAY-1-PROOF] stage=2 label=sheet-replay-sha256 result=PASS
[REPLAY] shadowWriteGuard relayStateMutations=0 result=PASS
[E3-REPLAY-1-PROOF] stage=3 label=module-replay-clean result=PASS
[E3-REPLAY-1-PROOF] stage=4 label=partial-replay-range result=PASS
[E3-REPLAY-1-PROOF] stage=5 label=divergence-detection result=PASS
[E3-REPLAY-1-PROOF] stage=6 label=divergence-scar result=PASS
[E3-REPLAY-1-PROOF] stage=7 label=performance-gate result=PASS
[E3-REPLAY-1-PROOF] stage=8 label=headless-replay-parity result=PASS
[E3-REPLAY-1-PROOF] stage=9 label=non-interference result=PASS
[E3-REPLAY-1-PROOF] gate-summary result=PASS stages=9/9
[ENU] Coordinate system loaded - all geometry in meters
[HEADLESS] mode=FORCED reason=urlParam
05:25:01.711 ℹ️ [GLOBE] imagery mode=osm provider=OpenStreetMap
05:25:01.718 ℹ️ [PRES] colorCorrection added=PASS vignette=ON coolTone=ON
05:25:01.719 ℹ️ [PRES] postFX enabled=PASS fxaa=ON bloom=ON colorCorrect=ON
05:25:01.719 ℹ️ [PRES] fog enabled=PASS density=0.00048
05:25:01.721 ⚠️ ⚠️ Buildings marked as DEGRADED
05:25:01.721 ℹ️ [LAUNCH-FIX] basemapDim brightness=0.28 contrast=0.55 saturation=0.05 gamma=1.6 applied=PASS
05:25:01.722 ℹ️ [LAUNCH] visibilityMode enabled=PASS scale=0.25 trunkPrimitive=cylinder widthFloors=ON basemapDimming=ON
05:25:01.722 ℹ️ [PRES] environmentDeemphasis applied=PASS brightness=0.28 saturation=0.05 gamma=1.6
05:25:01.722 ℹ️ [GLOBE] services weatherBase=http://127.0.0.1:4020
05:25:01.723 ℹ️ [GLOBE] imagery registry enabled modes=local,clean-street,satellite,hybrid,osm,dark,minimalist
05:25:01.723 ℹ️ [CAM] restore-POV skipped for launch (deterministic frame)
05:25:01.724 ℹ️ [INPUT] owner=CAMERA mode=FreeFly reason=default
[RelationshipRenderer] Initialized
[RelationshipRenderer] Cleared all relationships
[BoundaryRenderer] DataSource created and added to viewer
[BoundaryRenderer] Initialized
[BoundaryRenderer] Loading ISR from data/boundaries/countries/ISR-ADM0.geojson
[BoundaryRenderer] Loading USA from data/boundaries/countries/USA-ADM0.geojson
05:25:01.726 ℹ️ [BOUNDARY-EDITOR] Initialized
[FILAMENT] registry initialized=PASS total=6
[DISCLOSURE] restore backend=localStorage loaded=0 result=PASS
[TIMEBOX] event type=DISCLOSURE_CHANGE id=FIL-003 applied=PASS target=trunk.avgol timeboxId=T6
[DISCLOSURE] id=FIL-003 from=PRIVATE to=WITNESSED reason=lifecycle_default result=PASS
[DISCLOSURE] persist backend=localStorage stored=6 result=PASS
[TIMEBOX] event type=DISCLOSURE_CHANGE id=FIL-004 applied=PASS target=trunk.avgol timeboxId=T6
[DISCLOSURE] id=FIL-004 from=PRIVATE to=PUBLIC_SUMMARY reason=lifecycle_default result=PASS
[DISCLOSURE] persist backend=localStorage stored=6 result=PASS
[TIMEBOX] event type=DISCLOSURE_CHANGE id=FIL-005 applied=PASS target=trunk.avgol timeboxId=T6
[DISCLOSURE] id=FIL-005 from=PRIVATE to=PUBLIC_SUMMARY reason=lifecycle_default result=PASS
[DISCLOSURE] persist backend=localStorage stored=6 result=PASS
[TIMEBOX] event type=DISCLOSURE_CHANGE id=FIL-006 applied=PASS target=trunk.avgol timeboxId=T6
[DISCLOSURE] id=FIL-006 from=PRIVATE to=WITNESSED reason=lifecycle_default result=PASS
[DISCLOSURE] persist backend=localStorage stored=6 result=PASS
[GroupMarkerNotSet(crbug.com/242999)!:A0B02200B4010000]Automatic fallback to software WebGL has been deprecated. Please use the --enable-unsafe-swiftshader (about:flags#enable-unsafe-swiftshader) flag to opt in to lower security guarantees for trusted content.
[.WebGL-0x2acc02e84e00]GL Driver Message (OpenGL, Performance, GL_CLOSE_PATH_NV, High): GPU stall due to ReadPixels
[.WebGL-0x2acc02e84e00]GL Driver Message (OpenGL, Performance, GL_CLOSE_PATH_NV, High): GPU stall due to ReadPixels
[BoundaryRenderer] ✅ ISR: Loaded 1/1 features
[.WebGL-0x2acc02e84e00]GL Driver Message (OpenGL, Performance, GL_CLOSE_PATH_NV, High): GPU stall due to ReadPixels
[BoundaryRenderer] ✅ USA: Loaded 1/1 features
05:25:02.472 ℹ️ [BOUNDARY] containsll suite=PASS polygons=1 multipolygons=1 holes=0
05:25:02.472 ℹ️ [BOUNDARY] containsll hole-suite=PASS probes=3
05:25:02.473 ℹ️ [BOUNDARY] restore result=PASS renderer=BoundaryRenderer containsLL=PASS ISR=1 USA=1
05:25:02.473 ℹ️ [GATE] G3 status=PASS evidence=runtime-boundary-selftest
05:25:02.473 ℹ️ [UX] boundaries=ACTIVE mode=READ_ONLY
05:25:02.473 ℹ️ [BOUNDARY] voting-scope mode=BOUNDARY_ENABLED reason=boundary-pass
[.WebGL-0x2acc02e84e00]GL Driver Message (OpenGL, Performance, GL_CLOSE_PATH_NV, High): GPU stall due to ReadPixels (this message will no longer repeat)
05:25:02.750 ℹ️ [BOUNDARY] manifestLoaded countries=27
[BoundaryRenderer] Loading USA from data/boundaries/countries/USA-ADM0.geojson
[BOUNDARY] reuse id=boundary-USA-0-6c62914d
[BoundaryRenderer] Loading BRA from data/boundaries/countries/BRA-ADM0.geojson
05:25:03.215 ℹ️ [VOTE] restore backend=localStorage mode=demo loaded=0 result=PASS
[VOTE] restore backend=localStorage mode=demo loaded=0 result=PASS
[BACKING] id=branch.finance filaments=3 timeboxes=7 evidence=0 missing=0
[CONF] id=branch.finance conf=0.40 breakdown=tb:1,ev:0,disc:1,vote:0
[ATTN] id=branch.finance attn=0.20 lifecycle=SETTLING disclosure=WITNESSED vote=PENDING
[BACKING] id=branch.maintenance filaments=3 timeboxes=7 evidence=0 missing=0
[CONF] id=branch.maintenance conf=0.40 breakdown=tb:1,ev:0,disc:1,vote:0
[ATTN] id=branch.maintenance attn=0.36 lifecycle=REFUSAL disclosure=PUBLIC_SUMMARY vote=PENDING
[AC] aggregateAttention scope=company result=0.36 children=8
[AC] aggregateConfidence scope=company result=0.35 children=8
[AC] initialized=PASS functions=5 filaments=6
05:25:03.221 ℹ️ [PRES] launchTransform scale=0.25 uOffset=0 applied=PASS
05:25:03.222 ℹ️ [LAUNCH-FIX] visualHierarchy applied=PASS tilesAlpha=0.018 trunkCore=0.96 branchAlpha=0.18
05:25:03.222 ℹ️ [LAUNCH-THEME] tokens loaded trunk=thinPillar tile=horizontalPlatform filament=rain
05:25:03.222 ℹ️ [GATE] launchVisibility semantics=UNCHANGED enuChecks=RAW
05:25:03.222 ℹ️ [LAUNCH] widthFloors trunk=20m branches=13/10/6 tiles=90x52m rule=uniform
05:25:03.223 ℹ️ [PRES] trunkStyle applied=PASS mode=core+shell coreR=12 shellR=20
05:25:03.223 ℹ️ [PRES] branchStyle applied=PASS ribMode=ON ribScale=0.18 emissive=ON alpha=0.18
05:25:03.223 ℹ️ [PRES] sheetPlatform grid=PASS majorLines=16 mode=overview normal=UP horizontal=ON landscape=120x70
05:25:03.224 ℹ️ [PRES] tileFloatMode=PASS supportFilaments=ON fillAlpha=0.018 borderAlpha=1.0
05:25:03.224 ℹ️ [PRES] filamentRain enabled=PASS density=2
05:25:03.224 ℹ️ [PRES] rootGlow enabled=PASS radius=80 alpha=0.10
05:25:03.225 ℹ️ [GATE 4] Anchor marker rendered at (34.7818, 32.0853) - independent of buildings/terrain
05:25:03.227 ℹ️ [PRES] tether rendered=PASS
05:25:03.228 ℹ️ [PRES] buildingAnchorProxy rendered=PASS reason=buildings-degraded
05:25:03.228 ℹ️ [GATE 4] Anchor marker rendered at (34.7818, 32.0853) - independent of buildings/terrain
05:25:03.229 ℹ️ [GATE 4] Anchor marker rendered at (34.7818, 32.0853) - independent of buildings/terrain
05:25:03.229 ℹ️ [GATE 4] Anchor marker rendered at (34.7818, 32.0853) - independent of buildings/terrain
05:25:03.230 ℹ️ [GATE 4] Anchor marker rendered at (34.7818, 32.0853) - independent of buildings/terrain
05:25:03.230 ℹ️ [GATE 4] Anchor marker rendered at (34.7818, 32.0853) - independent of buildings/terrain
05:25:03.231 ℹ️ [VIS] voteFilter LOD=COMPANY override=ALL
05:25:03.237 ℹ️ [UX] debugLogs=false gateSpamSuppressed=true
05:25:03.242 ℹ️ [PRES] junctions rendered=PASS count=8
05:25:03.242 ℹ️ [VIS2] expandedSheetsAllowed=false scope=world
05:25:03.242 ℹ️ [VIS2] suppressSheetDetail=true expandedSheetsAllowed=false selectedSheet=none lod=COMPANY
05:25:03.243 ℹ️ [VIS-LAUNCH] ringContainment mode=collapsed action=suppressNonFocused result=PASS
[FILAMENT] bandSnap id=FIL-001 timeboxId=FIN-T4 deltaM=0 result=PASS
[FILAMENT] bandSnap id=FIL-002 timeboxId=FIN-T3 deltaM=0 result=PASS
[FILAMENT] bandSnap id=FIL-003 timeboxId=FIN-T1 deltaM=0 result=PASS
[FILAMENT] bandSnap id=FIL-004 timeboxId=MNT-T0 deltaM=0 result=PASS
[FILAMENT] bandSnap id=FIL-006 timeboxId=MNT-T1 deltaM=0 result=PASS
[FILAMENT] bandSnap source=vis4Registry
[DISCLOSURE] markersRendered count=5 tiers={PRIVATE:2,WITNESSED:2,PUBLIC_SUMMARY:1,FULL_PUBLIC:0}
05:25:03.244 ℹ️ [VIS2] deptSpinesRendered count=8
05:25:03.244 ℹ️ [VIS2] companyCollapsed result=PASS sheetsRendered=0 lod=COMPANY scope=world expandedSheetsAllowed=false
05:25:03.249 ℹ️ [VIS2] sheetTilesRendered count=39
05:25:03.249 ℹ️ [VIS2] exitSheet collapsed=PASS expanded=0 tiles=39
05:25:03.250 ℹ️ [VIS3] flowOverlay result=PASS edges=66 exceptions=11 scope=world lod=COMPANY
05:25:03.250 ℹ️ [VIS3] trafficBarsRendered count=8
05:25:03.251 ℹ️ [VIS3] gate-summary result=PASS
05:25:03.253 ℹ️ [VIS4c] labelsRendered count=36 scope=company
05:25:03.253 ℹ️ [VIS4] slabsRendered scope=company objects=9 slabs=36 capped=false
05:25:03.253 ℹ️ [VIS4] companySlabs result=PASS deptBranches=8 trunkSlabs=6
05:25:03.253 ℹ️ [VIS4] gate-summary result=PASS
05:25:03.254 ℹ️ [LOD-BUDGET] frame sheetsDetailed=0 totalMarkers=0 totalPrims=125 totalEntities=97
05:25:03.674 ℹ️ [GLOBE] worldTrunks synced added=5 total=6
05:25:03.675 ℹ️ [GLOBE] datasetLoad anchors=6
05:25:03.675 ℹ️ [UX] multiCountrySmoke=PASS anchors=6
05:25:03.676 ℹ️ [LAUNCH-FIX] cameraFrame target=trunk.avgol result=PASS distM=750 horzM=1000 heading=355 pitch=-28 applied=PASS
05:25:03.677 ℹ️ [HUD] mode=FreeFly layer1=6 layer2=0
05:25:03.681 ℹ️ [HUD] consolidated rootCount=1 duplicates=0
05:25:03.687 ℹ️ [HUD] tier1 rows=6
05:25:03.687 ℹ️ [HUD] tier2 default=collapsed
05:25:03.688 ℹ️ [PRES] billboard=ON reason=launch-default
05:25:03.688 ℹ️ [UX] debugLogs=false (launch mode)
05:25:03.689 ℹ️ [LAUNCH-FIX] uiGating launch=true hiddenPanels=artifacts,ux3,p2p,topicLane,vote,workMode,logConsole applied=PASS
05:25:03.694 ℹ️ [LAUNCH-FIX] hud tier1=ON tier2=OFF default=collapsed
05:25:03.694 ℹ️ [LAUNCH-FIX] helpOverlay shown=true dismissed=false source=first
[BUILD] 2026-02-09T12:30Z ux-1.1-universal-object-contract
05:25:03.696 ℹ️ [UX-1.1-PROOF] type=trunk id=trunk.avgol scope=root actions=focusView,showKPIs,showTimeboxes,showBranches,cycleClusterLevel,focusNextRegion,loadGlobalCore
05:25:03.696 ℹ️ [UX-1.1-PROOF] type=branch id=branch.operations scope=trunk.avgol actions=focusView,showKPIs,showTimeboxes,showPressureSources,cycleClusterLevel,focusNextRegion,loadGlobalCore
05:25:03.696 ℹ️ [UX-1.1-PROOF] type=sheet id=sheet.packaging scope=branch.operations actions=focusView,showSchema,addColumn,addValidation,addSummaryBinding
05:25:03.697 ℹ️ [UX-1.1-PROOF] type=cell id=sheet.packaging.cell.0.0 scope=branch.operations actions=edit,viewDependencies,viewHistory,createValidation,lockScope
05:25:03.697 ℹ️ [UX-1.1-PROOF] type=match id=3WM-001 scope=branch.p2p.mc1 actions=inspectSources,viewVariance,setTolerance,markResolved
05:25:03.697 ℹ️ [UX-1.1-PROOF] type=route id=p2p.requisition scope=branch.p2p.fc1 actions=previewMapping,ingestTestRecord,showProvenance,editFieldMap
05:25:03.697 ℹ️ [UX-1.1-PROOF] type=module id=P2P scope=trunk.avgol actions=showAllSheets,showRoutes,showKPIBindings,showRecomputationChain
05:25:03.697 ℹ️ [UX-1.1] Universal Object Contract: 7 types resolved
05:25:03.698 ℹ️ [PRESENCE] engine enabled=PASS ttlMs=15000 hbMs=3000
[PRESENCE] engine enabled=PASS ttlMs=15000 hbMs=3000
05:25:03.698 ℹ️ [PRESENCE] room resolve scope=trunk.avgol roomId=room.111ef3ac result=PASS
[PRESENCE] room resolve scope=trunk.avgol roomId=room.111ef3ac result=PASS
05:25:03.699 ℹ️ [PRESENCE] join user=user.local.mlq5suhe room=room.111ef3ac members=1 result=PASS
[PRESENCE] join user=user.local.mlq5suhe room=room.111ef3ac members=1 result=PASS
05:25:03.702 ℹ️ [VIS8] renderEngine enabled=PASS topology=mesh sfuReady=true
[VIS8] renderEngine enabled=PASS topology=mesh sfuReady=true
05:25:03.706 ℹ️ [VIS8] rtc join user=user.local.mlq5suhe room=room.111ef3ac peers=0 result=PASS
[VIS8] rtc join user=user.local.mlq5suhe room=room.111ef3ac peers=0 result=PASS
05:25:03.707 ℹ️ [PRESENCE] bind deferred=PASS reason=scopeNotReady
[PRESENCE] bind deferred=PASS reason=scopeNotReady
05:25:03.707 ℹ️ [VIS8] budget decode active=1 max=2 lod=COMPANY
[VIS8] budget decode active=1 max=2 lod=COMPANY
05:25:03.707 ℹ️ [VIS8] budget render active=1 max=4 lod=COMPANY
[VIS8] budget render active=1 max=4 lod=COMPANY
05:25:03.708 ℹ️ [VIS8] lodSwitch user=user.local.mlq5suhe from=dot to=billboard trigger=scope
[VIS8] lodSwitch user=user.local.mlq5suhe from=dot to=billboard trigger=scope
05:25:03.708 ℹ️ [VIS8] renderCard user=user.local.mlq5suhe lod=billboard video=off reason=consent
[VIS8] renderCard user=user.local.mlq5suhe lod=billboard video=off reason=consent
[CRYPTO] chainInit global=PASS genesisHash=GENESIS commits=0
05:25:03.709 ℹ️ [CAM] basin-proximity target=branch.maintenance type=branch radiusM=6000.0 distanceM=1584.3 assist=BLOCKED_LAUNCH
05:25:03.712 ℹ️ [VIS] sheetSelect resolved sheet=MFG.MaterialIssues reason=default
[VIS] sheetSelect resolved sheet=MFG.MaterialIssues reason=default
05:25:03.712 ℹ️ [VIS] enter sheet=MFG.MaterialIssues scope=sheet-only
[VIS] enter sheet=MFG.MaterialIssues scope=sheet-only
05:25:03.712 ℹ️ [DOCK] enterSheet target=MFG.MaterialIssues mode=FaceOn result=PASS distM=1196
05:25:03.712 ℹ️ [CAM] Face-on: instant snap (duration=0 method=setView)
05:25:03.713 ℹ️ [LOD] apply level=CELL sheetsDetailed=1 lanes=1 markers=1
05:25:03.714 ℹ️ [DOCK] dist=105 align=-1.00 preview=true edit=false overlay=0.00
05:25:03.714 ℹ️ [DOCK] autoDock disabled=PASS reason=explicitEnter
[CRYPTO] chainInit sheets=PASS chains=0
05:25:03.746 ℹ️ [GATE 4] Anchor marker rendered at (-122.4194, 37.7749) - independent of buildings/terrain
05:25:03.747 ℹ️ [GATE 4] Anchor marker rendered at (-0.1276, 51.5072) - independent of buildings/terrain
05:25:03.747 ℹ️ [GATE 4] Anchor marker rendered at (77.2090, 28.6139) - independent of buildings/terrain
05:25:03.748 ℹ️ [GATE 4] Anchor marker rendered at (139.6917, 35.6895) - independent of buildings/terrain
05:25:03.748 ℹ️ [GATE 4] Anchor marker rendered at (-46.6333, -23.5505) - independent of buildings/terrain
05:25:03.752 ℹ️ [VIS2] expandedSheetsAllowed=true scope=sheet
05:25:03.752 ℹ️ [VIS2] suppressSheetDetail=false expandedSheetsAllowed=true selectedSheet=MFG.MaterialIssues lod=CELL
05:25:03.755 ℹ️ [VIS] sheetOnlyRender sheetsDetailed=1 selected=MFG.MaterialIssues hidden=38
05:25:03.760 ℹ️ [VIS2] sheetTilesRendered count=38
05:25:03.760 ℹ️ [VIS2] enterSheet expanded=1 tiles=38
05:25:03.760 ℹ️ [VIS3.2] sheetOverlay begin sheet=MFG.MaterialIssues scope=sheet
05:25:03.760 ℹ️ [VIS3.2] exceptionRows result=PASS sheet=MFG.MaterialIssues count=0
05:25:03.760 ℹ️ [VIS3.2] routeHighlights result=PASS sheet=MFG.MaterialIssues edges=0
05:25:03.760 ℹ️ [VIS3.2] budget exceptionOverlays=0 routeHighlights=0 capped=false
05:25:03.760 ℹ️ [VIS3.2] gate-summary result=PASS
05:25:03.760 ℹ️ [VIS4] sheetSlabGap enforced minGap=8m raw=2.5m effective=8.0m
05:25:03.761 ℹ️ [VIS4c] labelsRendered count=1 scope=sheet
05:25:03.761 ℹ️ [VIS4] slabsRendered scope=sheet objects=1 slabs=1 capped=false
05:25:03.761 ℹ️ [VIS4] sheetSlabs result=PASS sheet=MFG.MaterialIssues slabs=1
05:25:03.761 ℹ️ [VIS4] gate-summary result=PASS
05:25:03.761 ℹ️ [LOD-BUDGET] frame sheetsDetailed=1 totalMarkers=5 totalPrims=88 totalEntities=92
05:25:03.761 ℹ️ [CAM] dockFaceOn applied=PASS sheet=MFG.MaterialIssues
[2D] gridShown sheet=MFG.MaterialIssues rows=1 cols=5 populated=5 result=PASS
05:25:03.762 ℹ️ [CAM] basin-exit target=branch.maintenance
05:25:03.765 ℹ️ [LOD] apply level=LANIAKEA sheetsDetailed=0 lanes=0 markers=0
[BoundaryRenderer] ✅ BRA: Loaded 1/1 features
[BoundaryRenderer] Loading ARG from data/boundaries/countries/ARG-ADM0.geojson
05:25:04.041 ℹ️ [VIS8] mediaPermissions cam=prompt mic=prompt
[VIS8] mediaPermissions cam=prompt mic=prompt
05:25:04.044 ℹ️ [LOD] apply level=PLANETARY sheetsDetailed=0 lanes=0 markers=0
05:25:04.127 ℹ️ [HUD] paramsLoaded version=HUD-PARAMS-v0 policyRef=local:HUD-PARAMS-v0
05:25:04.150 ℹ️ [VIS] voteFilter LOD=PLANETARY visible=4 hidden=23
05:25:04.155 ℹ️ [VIS2] expandedSheetsAllowed=true scope=sheet
05:25:04.155 ℹ️ [VIS2] suppressSheetDetail=false expandedSheetsAllowed=true selectedSheet=MFG.MaterialIssues lod=PLANETARY
05:25:04.156 ℹ️ [VIS2] selectedSheet fallback=PASS sheetId=MFG.MaterialIssues
05:25:04.158 ℹ️ [VIS2] sheetTilesRendered count=14
05:25:04.158 ℹ️ [VIS2] enterSheet expanded=1 tiles=14
05:25:04.158 ℹ️ [LOD-BUDGET] frame sheetsDetailed=1 totalMarkers=0 totalPrims=30 totalEntities=53
[BoundaryRenderer] ✅ ARG: Loaded 1/1 features
[BoundaryRenderer] Loading GBR from data/boundaries/countries/GBR-ADM0.geojson
05:25:04.388 ℹ️ [LOD] apply level=REGION sheetsDetailed=0 lanes=0 markers=0
[BoundaryRenderer] ✅ GBR: Loaded 1/1 features
[BoundaryRenderer] Loading FRA from data/boundaries/countries/FRA-ADM0.geojson
05:25:04.611 ℹ️ [CAM] basin-proximity target=trunk.avgol type=trunk radiusM=20000.0 distanceM=14779.7 assist=BLOCKED_LAUNCH
05:25:04.611 ℹ️ [LOD] apply level=COMPANY requestedSheetsDetailed=1 effectiveSheetsDetailed=1 lanes=1 markers=0 reason=explicitEnter distKm=14.8
05:25:04.742 ℹ️ [VIS] voteFilter LOD=COMPANY override=ALL
05:25:04.747 ℹ️ [VIS2] expandedSheetsAllowed=true scope=sheet
05:25:04.747 ℹ️ [VIS2] suppressSheetDetail=false expandedSheetsAllowed=true selectedSheet=MFG.MaterialIssues lod=COMPANY
05:25:04.748 ℹ️ [VIS] basinRings anchor=trunk.avgol companies=11 mode=cluster
05:25:04.749 ℹ️ [LOD] COMPANY markersOverride=false MarkerCells=0
05:25:04.754 ℹ️ [VIS2] sheetTilesRendered count=38
05:25:04.754 ℹ️ [VIS2] enterSheet expanded=1 tiles=38
05:25:04.754 ℹ️ [LOD-BUDGET] frame sheetsDetailed=1 totalMarkers=0 totalPrims=82 totalEntities=82
05:25:05.296 ℹ️ [DOCK] dist=14425 align=0.10 preview=false edit=false overlay=0.95
05:25:06.156 ℹ️ [VIS] exit sheet=MFG.MaterialIssues restoreView=true
[VIS] exit sheet=MFG.MaterialIssues restoreView=true
[2D] gridHidden reason=exitSheet result=PASS
[VIS] exitSheet cleanup=PASS cleared=sheetId,anchor,selection,forceCompanyScope,explicitEnter,autoDockFlags
05:25:06.158 ℹ️ [VIS] enter company=trunk.avgol
[VIS] enter company=trunk.avgol
05:25:06.160 ℹ️ [CAM] focusLock target=trunk.avgol scope=company result=PASS
05:25:06.160 ℹ️ [INPUT] owner=CAMERA mode=FreeFly reason=focusLock
05:25:06.160 ℹ️ [LOD] lock level=COMPANY reason=basinFocus
05:25:06.162 ℹ️ [HUD] votes summary=PASS passed=4 pending=2 rejected=0
[HUD] votes summary=PASS passed=4 pending=2 rejected=0
[BoundaryRenderer] ✅ FRA: Loaded 1/1 features
[BoundaryRenderer] Loading DEU from data/boundaries/countries/DEU-ADM0.geojson
05:25:06.257 ℹ️ [VIS2] expandedSheetsAllowed=false scope=company
05:25:06.258 ℹ️ [VIS2] suppressSheetDetail=true expandedSheetsAllowed=false selectedSheet=none lod=COMPANY
05:25:06.259 ℹ️ [VIS2] deptSpinesRendered count=8
05:25:06.259 ℹ️ [VIS2] companyCollapsed result=PASS sheetsRendered=0 lod=COMPANY scope=company expandedSheetsAllowed=false
05:25:06.267 ℹ️ [VIS2] sheetTilesRendered count=39
05:25:06.267 ℹ️ [VIS2] exitSheet collapsed=PASS expanded=0 tiles=39
05:25:06.268 ℹ️ [VIS3] flowOverlay result=PASS edges=66 exceptions=11 scope=company lod=COMPANY
05:25:06.268 ℹ️ [VIS3] trafficBarsRendered count=8
05:25:06.268 ℹ️ [VIS3] gate-summary result=PASS
05:25:06.272 ℹ️ [VIS4c] labelsRendered count=51 scope=company
05:25:06.273 ℹ️ [VIS4] slabsRendered scope=company objects=14 slabs=51 capped=false
05:25:06.273 ℹ️ [VIS4] companySlabs result=PASS deptBranches=8 trunkSlabs=21
05:25:06.273 ℹ️ [VIS4] gate-summary result=PASS
05:25:06.273 ℹ️ [LOD-BUDGET] frame sheetsDetailed=0 totalMarkers=0 totalPrims=145 totalEntities=132
WebSocket connection to 'ws://127.0.0.1:4031/vis8' failed: Error in connection establishment: net::ERR_CONNECTION_REFUSED
[REPLAY] start scope=sheet moduleId=none sheetId=sheet.packaging from=0 to=latest
05:25:06.679 ℹ️ [DOCK] dist=6308 align=-0.10 preview=false edit=false overlay=0.00
05:25:06.900 ℹ️ [PRESENCE] transport degraded=PASS mode=local-only reason=wsConnectFailed
[PRESENCE] transport degraded=PASS mode=local-only reason=wsConnectFailed
Access to script at 'node:crypto' from origin 'http://127.0.0.1:3000' has been blocked by CORS policy: Cross origin requests are only supported for protocol schemes: chrome, chrome-untrusted, data, http, https.
Failed to load resource: net::ERR_FAILED
05:25:07.069 ℹ️ [HUD] mode=CompanyFocus
05:25:07.462 ℹ️ [PRESENCE] hb user=user.local.mlq5suhe room=room.111ef3ac ageMs=3763 result=PASS
[PRESENCE] hb user=user.local.mlq5suhe room=room.111ef3ac ageMs=3763 result=PASS
05:25:07.534 ℹ️ [CAM] basinFocus settled target=trunk.avgol distM=900 pitch=-55
[BoundaryRenderer] ✅ DEU: Loaded 1/1 features
[BoundaryRenderer] Loading NLD from data/boundaries/countries/NLD-ADM0.geojson
05:25:07.822 ℹ️ [DOCK] dist=761 align=0.05 preview=false edit=false overlay=0.00
[REPLAY] sheet sheetId=sheet.packaging commitCount=0 replayHash=44136fa355b3678a liveHash=44136fa355b3678a result=MATCH
[BoundaryRenderer] ✅ NLD: Loaded 1/1 features
[BoundaryRenderer] Loading EGY from data/boundaries/countries/EGY-ADM0.geojson
05:25:09.262 ℹ️ [DOCK] dist=761 align=0.05 preview=false edit=false overlay=0.00
05:25:10.174 ℹ️ [PRESENCE] hb user=user.local.mlq5suhe room=room.111ef3ac ageMs=2712 result=PASS
[PRESENCE] hb user=user.local.mlq5suhe room=room.111ef3ac ageMs=2712 result=PASS
[BoundaryRenderer] ✅ EGY: Loaded 1/1 features
[BoundaryRenderer] Loading SAU from data/boundaries/countries/SAU-ADM0.geojson
05:25:10.568 ℹ️ [DOCK] dist=761 align=0.05 preview=false edit=false overlay=0.00
[CRYPTO] merkleInit timeboxes=PASS count=6 rollingRoot=879d4f090ced7cd8
[CRYPTO] chainStamp mode=derived commits=0 sheets=0 timeboxes=6
05:25:11.778 ℹ️ [DOCK] dist=761 align=0.05 preview=false edit=false overlay=0.00
[BoundaryRenderer] ✅ SAU: Loaded 1/1 features
[BoundaryRenderer] Loading IND from data/boundaries/countries/IND-ADM0.geojson
[BoundaryRenderer] ✅ IND: Loaded 1/1 features
[BoundaryRenderer] Loading CHN from data/boundaries/countries/CHN-ADM0.geojson
05:25:13.028 ℹ️ [DOCK] dist=761 align=0.05 preview=false edit=false overlay=0.00
05:25:13.322 ℹ️ [PRESENCE] hb user=user.local.mlq5suhe room=room.111ef3ac ageMs=3148 result=PASS
[PRESENCE] hb user=user.local.mlq5suhe room=room.111ef3ac ageMs=3148 result=PASS
[BoundaryRenderer] ✅ CHN: Loaded 1/1 features
[BoundaryRenderer] Loading KOR from data/boundaries/countries/KOR-ADM0.geojson
05:25:14.221 ℹ️ [DOCK] dist=761 align=0.05 preview=false edit=false overlay=0.00
[BoundaryRenderer] ✅ KOR: Loaded 1/1 features
[BoundaryRenderer] Loading ISR from data/boundaries/countries/ISR-ADM0.geojson
05:25:15.322 ℹ️ [DOCK] dist=761 align=0.05 preview=false edit=false overlay=0.00
[BOUNDARY] reuse id=boundary-ISR-0-0050ba14
05:25:15.561 ℹ️ [GLOBE] country-set id=global-core loaded=26
[BoundaryRenderer] Loading USA from data/boundaries/countries/USA-ADM0.geojson
05:25:16.154 ℹ️ [PRESENCE] hb user=user.local.mlq5suhe room=room.111ef3ac ageMs=2832 result=PASS
[PRESENCE] hb user=user.local.mlq5suhe room=room.111ef3ac ageMs=2832 result=PASS
05:25:16.506 ℹ️ [DOCK] dist=761 align=0.05 preview=false edit=false overlay=0.00
[BoundaryRenderer] Loading USA from data/boundaries/countries/USA-ADM0.geojson
05:25:17.771 ℹ️ [DOCK] dist=761 align=0.05 preview=false edit=false overlay=0.00
05:25:18.068 ℹ️ [GLOBE] focus country=USA
05:25:18.068 ℹ️ [GLOBE] focus region=north-america
05:25:18.069 ℹ️ [GLOBE] hierarchy init cluster=globe countries=11
[BoundaryRenderer] Loading USA from data/boundaries/countries/USA-ADM0.geojson
[CRYPTO] verify scope=full global=VALID sheets=VALID merkle=VALID rolling=VALID overall=VALID emitScar=false durationMs=6662
[CRYPTO] replayPreCheck result=PASS durationMs=6662
[REPLAY] start scope=module moduleId=P2P from=0 to=latest
05:25:18.369 ℹ️ [CAM] basin-exit target=branch.maintenance
05:25:19.187 ℹ️ [PRESENCE] hb user=user.local.mlq5suhe room=room.111ef3ac ageMs=3033 result=PASS
[PRESENCE] hb user=user.local.mlq5suhe room=room.111ef3ac ageMs=3033 result=PASS
05:25:19.216 ℹ️ [DOCK] dist=24610836 align=0.33 preview=false edit=false overlay=0.00
[BoundaryRenderer] Loading ISR from data/boundaries/countries/ISR-ADM0.geojson
05:25:20.500 ℹ️ [GLOBE] country-set id=global-core loaded=26
05:25:20.500 ℹ️ [GLOBE] cluster level=globe focusCountry=USA
05:25:20.517 ℹ️ [DOCK] dist=24611023 align=0.33 preview=false edit=false overlay=0.00
[REPLAY] golden-compare facts=M matches=M summaries=M kpis=M commits=M packets=M ledger=M
[REPLAY] timing ingest=1ms matches=0ms summaries=0ms kpis=0ms packets=0ms ledger=0ms hashCompare=2453ms total=2454ms
[REPLAY] module moduleId=P2P result=MATCH
[REPLAY] perf-gate count=35 totalMs=2454 threshold=60000 result=PASS
05:25:21.801 ℹ️ [DOCK] dist=24611023 align=0.33 preview=false edit=false overlay=0.00
05:25:22.109 ℹ️ [PRESENCE] hb user=user.local.mlq5suhe room=room.111ef3ac ageMs=2922 result=PASS
[PRESENCE] hb user=user.local.mlq5suhe room=room.111ef3ac ageMs=2922 result=PASS
05:25:23.085 ℹ️ [DOCK] dist=24611023 align=0.33 preview=false edit=false overlay=0.00
05:25:24.322 ℹ️ [DOCK] dist=24611023 align=0.33 preview=false edit=false overlay=0.00
05:25:25.151 ℹ️ [PRESENCE] hb user=user.local.mlq5suhe room=room.111ef3ac ageMs=3042 result=PASS
[PRESENCE] hb user=user.local.mlq5suhe room=room.111ef3ac ageMs=3042 result=PASS
05:25:25.490 ℹ️ [DOCK] dist=24611023 align=0.33 preview=false edit=false overlay=0.00
05:25:26.771 ℹ️ [DOCK] dist=24611023 align=0.33 preview=false edit=false overlay=0.00
05:25:28.056 ℹ️ [PRESENCE] hb user=user.local.mlq5suhe room=room.111ef3ac ageMs=2905 result=PASS
[PRESENCE] hb user=user.local.mlq5suhe room=room.111ef3ac ageMs=2905 result=PASS
05:25:28.067 ℹ️ [DOCK] dist=24611023 align=0.33 preview=false edit=false overlay=0.00
[CRYPTO] verify scope=full global=VALID sheets=VALID merkle=VALID rolling=VALID overall=VALID emitScar=false durationMs=4689
[CRYPTO] replayPreCheck result=PASS durationMs=4689
[REPLAY] start scope=module moduleId=P2P from=0 to=5
[REPLAY] golden-compare facts=M matches=M summaries=M kpis=M commits=M packets=M ledger=M
[REPLAY] timing ingest=0ms matches=0ms summaries=0ms kpis=0ms packets=0ms ledger=0ms hashCompare=1ms total=1ms
[REPLAY] module moduleId=P2P result=MATCH
[REPLAY] perf-gate count=35 totalMs=1 threshold=60000 result=PASS
05:25:29.369 ℹ️ [DOCK] dist=24611023 align=0.33 preview=false edit=false overlay=0.00
05:25:30.573 ℹ️ [DOCK] dist=24611023 align=0.33 preview=false edit=false overlay=0.00
[REPLAY] divergenceDebug allSheets=39 factSheets=0 factIds=
[REPLAY] divergenceTest mutationApplied=true
05:25:31.055 ℹ️ [PRESENCE] hb user=user.local.mlq5suhe room=room.111ef3ac ageMs=2999 result=PASS
[PRESENCE] hb user=user.local.mlq5suhe room=room.111ef3ac ageMs=2999 result=PASS
05:25:31.749 ℹ️ [DOCK] dist=24611023 align=0.33 preview=false edit=false overlay=0.00
[REPLAY] divergenceCheck baseline.facts=4f53cda18c2b mutated.facts=d1c5fbc4a78d changed=true
05:25:32.931 ℹ️ [DOCK] dist=24611023 align=0.33 preview=false edit=false overlay=0.00
05:25:34.176 ℹ️ [PRESENCE] hb user=user.local.mlq5suhe room=room.111ef3ac ageMs=3120 result=PASS
[PRESENCE] hb user=user.local.mlq5suhe room=room.111ef3ac ageMs=3120 result=PASS
05:25:34.181 ℹ️ [DOCK] dist=24611023 align=0.33 preview=false edit=false overlay=0.00
05:25:35.408 ℹ️ [DOCK] dist=24611023 align=0.33 preview=false edit=false overlay=0.00
05:25:36.578 ℹ️ [DOCK] dist=24611023 align=0.33 preview=false edit=false overlay=0.00
05:25:37.123 ℹ️ [PRESENCE] hb user=user.local.mlq5suhe room=room.111ef3ac ageMs=2948 result=PASS
[PRESENCE] hb user=user.local.mlq5suhe room=room.111ef3ac ageMs=2948 result=PASS
05:25:37.649 ℹ️ [DOCK] dist=24611023 align=0.33 preview=false edit=false overlay=0.00
[CRYPTO] verify scope=full global=VALID sheets=VALID merkle=VALID rolling=VALID overall=VALID emitScar=false durationMs=5813
[CRYPTO] replayPreCheck result=PASS durationMs=5813
[REPLAY] start scope=module moduleId=P2P from=0 to=latest
05:25:38.771 ℹ️ [DOCK] dist=24611023 align=0.33 preview=false edit=false overlay=0.00
05:25:39.862 ℹ️ [DOCK] dist=24611023 align=0.33 preview=false edit=false overlay=0.00
05:25:40.127 ℹ️ [PRESENCE] hb user=user.local.mlq5suhe room=room.111ef3ac ageMs=3004 result=PASS
[PRESENCE] hb user=user.local.mlq5suhe room=room.111ef3ac ageMs=3004 result=PASS
[REPLAY] golden-compare facts=D matches=D summaries=D kpis=M commits=M packets=M ledger=M
[REPLAY] timing ingest=0ms matches=0ms summaries=0ms kpis=0ms packets=0ms ledger=0ms hashCompare=1895ms total=1895ms
[REPLAY] module moduleId=P2P result=DIVERGENCE
05:25:40.128 ℹ️ [REFUSAL] reason=REPLAY_DIVERGENCE component=facts expected=4f53cda18c2baa0c actual=d1c5fbc4a78d6e01 moduleId=P2P commitRange=0-latest
[REFUSAL] reason=REPLAY_DIVERGENCE component=facts expected=4f53cda18c2baa0c actual=d1c5fbc4a78d6e01 moduleId=P2P commitRange=0-latest
[TIMEBOX] event type=REPLAY_DIVERGENCE id=REPLAY_DIVERGENCE applied=PASS target=trunk.avgol timeboxId=T6
05:25:40.129 ℹ️ [REFUSAL] reason=REPLAY_DIVERGENCE component=matches expected=4f53cda18c2baa0c actual=cf7d23ac7726da26 moduleId=P2P commitRange=0-latest
[REFUSAL] reason=REPLAY_DIVERGENCE component=matches expected=4f53cda18c2baa0c actual=cf7d23ac7726da26 moduleId=P2P commitRange=0-latest
[TIMEBOX] event type=REPLAY_DIVERGENCE id=REPLAY_DIVERGENCE applied=PASS target=trunk.avgol timeboxId=T6
05:25:40.129 ℹ️ [REFUSAL] reason=REPLAY_DIVERGENCE component=summaries expected=c7e8aee97a4a1c50 actual=403fc36afb332b4d moduleId=P2P commitRange=0-latest
[REFUSAL] reason=REPLAY_DIVERGENCE component=summaries expected=c7e8aee97a4a1c50 actual=403fc36afb332b4d moduleId=P2P commitRange=0-latest
[TIMEBOX] event type=REPLAY_DIVERGENCE id=REPLAY_DIVERGENCE applied=PASS target=trunk.avgol timeboxId=T6
[REPLAY] perf-gate count=35 totalMs=1895 threshold=60000 result=PASS
[REPLAY] divergenceTest mutationApplied=true mutationReverted=true result=PASS
[ENU] Coordinate system loaded - all geometry in meters
[HEADLESS] mode=FORCED reason=urlParam
05:25:41.660 ℹ️ [GLOBE] imagery mode=osm provider=OpenStreetMap
05:25:41.664 ℹ️ [PRES] colorCorrection added=PASS vignette=ON coolTone=ON
05:25:41.664 ℹ️ [PRES] postFX enabled=PASS fxaa=ON bloom=ON colorCorrect=ON
05:25:41.665 ℹ️ [PRES] fog enabled=PASS density=0.00048
05:25:41.667 ⚠️ ⚠️ Buildings marked as DEGRADED
05:25:41.668 ℹ️ [LAUNCH-FIX] basemapDim brightness=0.28 contrast=0.55 saturation=0.05 gamma=1.6 applied=PASS
05:25:41.669 ℹ️ [LAUNCH] visibilityMode enabled=PASS scale=0.25 trunkPrimitive=cylinder widthFloors=ON basemapDimming=ON
05:25:41.669 ℹ️ [PRES] environmentDeemphasis applied=PASS brightness=0.28 saturation=0.05 gamma=1.6
05:25:41.670 ℹ️ [GLOBE] services weatherBase=http://127.0.0.1:4020
05:25:41.670 ℹ️ [GLOBE] imagery registry enabled modes=local,clean-street,satellite,hybrid,osm,dark,minimalist
05:25:41.671 ℹ️ [CAM] restore-POV skipped for launch (deterministic frame)
05:25:41.672 ℹ️ [INPUT] owner=CAMERA mode=FreeFly reason=default
[RelationshipRenderer] Initialized
[RelationshipRenderer] Cleared all relationships
[BoundaryRenderer] DataSource created and added to viewer
[BoundaryRenderer] Initialized
[BoundaryRenderer] Loading ISR from data/boundaries/countries/ISR-ADM0.geojson
[BoundaryRenderer] Loading USA from data/boundaries/countries/USA-ADM0.geojson
05:25:41.674 ℹ️ [BOUNDARY-EDITOR] Initialized
[FILAMENT] registry initialized=PASS total=6
[DISCLOSURE] restore backend=localStorage loaded=6 result=PASS
[GroupMarkerNotSet(crbug.com/242999)!:A0B02200B4010000]Automatic fallback to software WebGL has been deprecated. Please use the --enable-unsafe-swiftshader (about:flags#enable-unsafe-swiftshader) flag to opt in to lower security guarantees for trusted content.
[BoundaryRenderer] ✅ ISR: Loaded 1/1 features
[BoundaryRenderer] ✅ USA: Loaded 1/1 features
05:25:42.493 ℹ️ [BOUNDARY] containsll suite=PASS polygons=1 multipolygons=1 holes=0
05:25:42.494 ℹ️ [BOUNDARY] containsll hole-suite=PASS probes=3
05:25:42.494 ℹ️ [BOUNDARY] restore result=PASS renderer=BoundaryRenderer containsLL=PASS ISR=1 USA=1
05:25:42.495 ℹ️ [GATE] G3 status=PASS evidence=runtime-boundary-selftest
05:25:42.495 ℹ️ [UX] boundaries=ACTIVE mode=READ_ONLY
05:25:42.495 ℹ️ [BOUNDARY] voting-scope mode=BOUNDARY_ENABLED reason=boundary-pass
05:25:42.943 ℹ️ [BOUNDARY] manifestLoaded countries=27
[BoundaryRenderer] Loading USA from data/boundaries/countries/USA-ADM0.geojson
[BOUNDARY] reuse id=boundary-USA-0-6c62914d
[BoundaryRenderer] Loading BRA from data/boundaries/countries/BRA-ADM0.geojson
05:25:44.056 ℹ️ [VOTE] restore backend=localStorage mode=demo loaded=0 result=PASS
[VOTE] restore backend=localStorage mode=demo loaded=0 result=PASS
[BACKING] id=branch.finance filaments=3 timeboxes=7 evidence=0 missing=0
[CONF] id=branch.finance conf=0.40 breakdown=tb:1,ev:0,disc:1,vote:0
[ATTN] id=branch.finance attn=0.20 lifecycle=SETTLING disclosure=WITNESSED vote=PENDING
[BACKING] id=branch.maintenance filaments=3 timeboxes=7 evidence=0 missing=0
[CONF] id=branch.maintenance conf=0.40 breakdown=tb:1,ev:0,disc:1,vote:0
[ATTN] id=branch.maintenance attn=0.36 lifecycle=REFUSAL disclosure=PUBLIC_SUMMARY vote=PENDING
[AC] aggregateAttention scope=company result=0.36 children=8
[AC] aggregateConfidence scope=company result=0.35 children=8
[AC] initialized=PASS functions=5 filaments=6
05:25:44.073 ℹ️ [PRES] launchTransform scale=0.25 uOffset=0 applied=PASS
05:25:44.075 ℹ️ [LAUNCH-FIX] visualHierarchy applied=PASS tilesAlpha=0.018 trunkCore=0.96 branchAlpha=0.18
05:25:44.075 ℹ️ [LAUNCH-THEME] tokens loaded trunk=thinPillar tile=horizontalPlatform filament=rain
05:25:44.076 ℹ️ [GATE] launchVisibility semantics=UNCHANGED enuChecks=RAW
05:25:44.076 ℹ️ [LAUNCH] widthFloors trunk=20m branches=13/10/6 tiles=90x52m rule=uniform
05:25:44.076 ℹ️ [PRES] trunkStyle applied=PASS mode=core+shell coreR=12 shellR=20
05:25:44.077 ℹ️ [PRES] branchStyle applied=PASS ribMode=ON ribScale=0.18 emissive=ON alpha=0.18
05:25:44.077 ℹ️ [PRES] sheetPlatform grid=PASS majorLines=16 mode=overview normal=UP horizontal=ON landscape=120x70
05:25:44.077 ℹ️ [PRES] tileFloatMode=PASS supportFilaments=ON fillAlpha=0.018 borderAlpha=1.0
05:25:44.078 ℹ️ [PRES] filamentRain enabled=PASS density=2
05:25:44.078 ℹ️ [PRES] rootGlow enabled=PASS radius=80 alpha=0.10
05:25:44.079 ℹ️ [GATE 4] Anchor marker rendered at (34.7818, 32.0853) - independent of buildings/terrain
05:25:44.081 ℹ️ [PRES] tether rendered=PASS
05:25:44.082 ℹ️ [PRES] buildingAnchorProxy rendered=PASS reason=buildings-degraded
05:25:44.083 ℹ️ [GATE 4] Anchor marker rendered at (34.7818, 32.0853) - independent of buildings/terrain
05:25:44.084 ℹ️ [GATE 4] Anchor marker rendered at (34.7818, 32.0853) - independent of buildings/terrain
05:25:44.085 ℹ️ [GATE 4] Anchor marker rendered at (34.7818, 32.0853) - independent of buildings/terrain
05:25:44.086 ℹ️ [GATE 4] Anchor marker rendered at (34.7818, 32.0853) - independent of buildings/terrain
05:25:44.087 ℹ️ [GATE 4] Anchor marker rendered at (34.7818, 32.0853) - independent of buildings/terrain
05:25:44.087 ℹ️ [VIS] voteFilter LOD=COMPANY override=ALL
05:25:44.093 ℹ️ [UX] debugLogs=false gateSpamSuppressed=true
05:25:44.099 ℹ️ [PRES] junctions rendered=PASS count=8
05:25:44.099 ℹ️ [VIS2] expandedSheetsAllowed=false scope=world
05:25:44.099 ℹ️ [VIS2] suppressSheetDetail=true expandedSheetsAllowed=false selectedSheet=none lod=COMPANY
05:25:44.100 ℹ️ [VIS-LAUNCH] ringContainment mode=collapsed action=suppressNonFocused result=PASS
[FILAMENT] bandSnap id=FIL-001 timeboxId=FIN-T4 deltaM=0 result=PASS
[FILAMENT] bandSnap id=FIL-002 timeboxId=FIN-T3 deltaM=0 result=PASS
[FILAMENT] bandSnap id=FIL-003 timeboxId=FIN-T1 deltaM=0 result=PASS
[FILAMENT] bandSnap id=FIL-004 timeboxId=MNT-T0 deltaM=0 result=PASS
[FILAMENT] bandSnap id=FIL-006 timeboxId=MNT-T1 deltaM=0 result=PASS
[FILAMENT] bandSnap source=vis4Registry
[DISCLOSURE] markersRendered count=5 tiers={PRIVATE:2,WITNESSED:2,PUBLIC_SUMMARY:1,FULL_PUBLIC:0}
05:25:44.102 ℹ️ [VIS2] deptSpinesRendered count=8
05:25:44.103 ℹ️ [VIS2] companyCollapsed result=PASS sheetsRendered=0 lod=COMPANY scope=world expandedSheetsAllowed=false
05:25:44.110 ℹ️ [VIS2] sheetTilesRendered count=39
05:25:44.110 ℹ️ [VIS2] exitSheet collapsed=PASS expanded=0 tiles=39
05:25:44.112 ℹ️ [VIS3] flowOverlay result=PASS edges=66 exceptions=11 scope=world lod=COMPANY
05:25:44.112 ℹ️ [VIS3] trafficBarsRendered count=8
05:25:44.112 ℹ️ [VIS3] gate-summary result=PASS
05:25:44.115 ℹ️ [VIS4c] labelsRendered count=36 scope=company
05:25:44.115 ℹ️ [VIS4] slabsRendered scope=company objects=9 slabs=36 capped=false
05:25:44.116 ℹ️ [VIS4] companySlabs result=PASS deptBranches=8 trunkSlabs=6
05:25:44.116 ℹ️ [VIS4] gate-summary result=PASS
05:25:44.117 ℹ️ [LOD-BUDGET] frame sheetsDetailed=0 totalMarkers=0 totalPrims=125 totalEntities=97
[BoundaryRenderer] ✅ BRA: Loaded 1/1 features
[BoundaryRenderer] Loading ARG from data/boundaries/countries/ARG-ADM0.geojson
05:25:45.513 ℹ️ [GLOBE] worldTrunks synced added=5 total=6
05:25:45.514 ℹ️ [GLOBE] datasetLoad anchors=6
05:25:45.514 ℹ️ [UX] multiCountrySmoke=PASS anchors=6
05:25:45.515 ℹ️ [LAUNCH-FIX] cameraFrame target=trunk.avgol result=PASS distM=750 horzM=1000 heading=355 pitch=-28 applied=PASS
05:25:45.517 ℹ️ [HUD] mode=FreeFly layer1=6 layer2=0
05:25:45.523 ℹ️ [HUD] consolidated rootCount=1 duplicates=0
05:25:45.530 ℹ️ [HUD] tier1 rows=6
05:25:45.531 ℹ️ [HUD] tier2 default=collapsed
05:25:45.532 ℹ️ [PRES] billboard=ON reason=launch-default
05:25:45.533 ℹ️ [UX] debugLogs=false (launch mode)
05:25:45.534 ℹ️ [LAUNCH-FIX] uiGating launch=true hiddenPanels=artifacts,ux3,p2p,topicLane,vote,workMode,logConsole applied=PASS
05:25:45.543 ℹ️ [LAUNCH-FIX] hud tier1=ON tier2=OFF default=collapsed
05:25:45.543 ℹ️ [LAUNCH-FIX] helpOverlay shown=true dismissed=false source=first
[BUILD] 2026-02-09T12:30Z ux-1.1-universal-object-contract
05:25:45.544 ℹ️ [UX-1.1-PROOF] type=trunk id=trunk.avgol scope=root actions=focusView,showKPIs,showTimeboxes,showBranches,cycleClusterLevel,focusNextRegion,loadGlobalCore
05:25:45.545 ℹ️ [UX-1.1-PROOF] type=branch id=branch.operations scope=trunk.avgol actions=focusView,showKPIs,showTimeboxes,showPressureSources,cycleClusterLevel,focusNextRegion,loadGlobalCore
05:25:45.546 ℹ️ [UX-1.1-PROOF] type=sheet id=sheet.packaging scope=branch.operations actions=focusView,showSchema,addColumn,addValidation,addSummaryBinding
05:25:45.546 ℹ️ [UX-1.1-PROOF] type=cell id=sheet.packaging.cell.0.0 scope=branch.operations actions=edit,viewDependencies,viewHistory,createValidation,lockScope
05:25:45.546 ℹ️ [UX-1.1-PROOF] type=match id=3WM-001 scope=branch.p2p.mc1 actions=inspectSources,viewVariance,setTolerance,markResolved
05:25:45.546 ℹ️ [UX-1.1-PROOF] type=route id=p2p.requisition scope=branch.p2p.fc1 actions=previewMapping,ingestTestRecord,showProvenance,editFieldMap
05:25:45.547 ℹ️ [UX-1.1-PROOF] type=module id=P2P scope=trunk.avgol actions=showAllSheets,showRoutes,showKPIBindings,showRecomputationChain
05:25:45.547 ℹ️ [UX-1.1] Universal Object Contract: 7 types resolved
05:25:45.547 ℹ️ [PRESENCE] engine enabled=PASS ttlMs=15000 hbMs=3000
[PRESENCE] engine enabled=PASS ttlMs=15000 hbMs=3000
05:25:45.548 ℹ️ [PRESENCE] room resolve scope=trunk.avgol roomId=room.111ef3ac result=PASS
[PRESENCE] room resolve scope=trunk.avgol roomId=room.111ef3ac result=PASS
05:25:45.548 ℹ️ [PRESENCE] join user=user.local.mlq5tqrv room=room.111ef3ac members=1 result=PASS
[PRESENCE] join user=user.local.mlq5tqrv room=room.111ef3ac members=1 result=PASS
05:25:45.549 ℹ️ [VIS8] renderEngine enabled=PASS topology=mesh sfuReady=true
[VIS8] renderEngine enabled=PASS topology=mesh sfuReady=true
05:25:45.550 ℹ️ [VIS8] rtc join user=user.local.mlq5tqrv room=room.111ef3ac peers=0 result=PASS
[VIS8] rtc join user=user.local.mlq5tqrv room=room.111ef3ac peers=0 result=PASS
05:25:45.550 ℹ️ [PRESENCE] bind deferred=PASS reason=scopeNotReady
[PRESENCE] bind deferred=PASS reason=scopeNotReady
05:25:45.551 ℹ️ [VIS8] budget decode active=1 max=2 lod=COMPANY
[VIS8] budget decode active=1 max=2 lod=COMPANY
05:25:45.551 ℹ️ [VIS8] budget render active=1 max=4 lod=COMPANY
[VIS8] budget render active=1 max=4 lod=COMPANY
05:25:45.551 ℹ️ [VIS8] lodSwitch user=user.local.mlq5tqrv from=dot to=billboard trigger=scope
[VIS8] lodSwitch user=user.local.mlq5tqrv from=dot to=billboard trigger=scope
05:25:45.551 ℹ️ [VIS8] renderCard user=user.local.mlq5tqrv lod=billboard video=off reason=consent
[VIS8] renderCard user=user.local.mlq5tqrv lod=billboard video=off reason=consent
[CRYPTO] chainInit global=PASS genesisHash=GENESIS commits=0
05:25:45.553 ℹ️ [CAM] basin-proximity target=branch.maintenance type=branch radiusM=6000.0 distanceM=1584.3 assist=BLOCKED_LAUNCH
05:25:45.556 ℹ️ [VIS] sheetSelect resolved sheet=MFG.MaterialIssues reason=default
[VIS] sheetSelect resolved sheet=MFG.MaterialIssues reason=default
05:25:45.556 ℹ️ [VIS] enter sheet=MFG.MaterialIssues scope=sheet-only
[VIS] enter sheet=MFG.MaterialIssues scope=sheet-only
05:25:45.556 ℹ️ [DOCK] enterSheet target=MFG.MaterialIssues mode=FaceOn result=PASS distM=1196
05:25:45.557 ℹ️ [CAM] Face-on: instant snap (duration=0 method=setView)
05:25:45.557 ℹ️ [LOD] apply level=CELL sheetsDetailed=1 lanes=1 markers=1
05:25:45.558 ℹ️ [DOCK] dist=105 align=-1.00 preview=true edit=false overlay=0.00
05:25:45.559 ℹ️ [DOCK] autoDock disabled=PASS reason=explicitEnter
[CRYPTO] chainInit sheets=PASS chains=0
05:25:45.687 ℹ️ [GATE 4] Anchor marker rendered at (-122.4194, 37.7749) - independent of buildings/terrain
05:25:45.689 ℹ️ [GATE 4] Anchor marker rendered at (-0.1276, 51.5072) - independent of buildings/terrain
05:25:45.689 ℹ️ [GATE 4] Anchor marker rendered at (77.2090, 28.6139) - independent of buildings/terrain
05:25:45.690 ℹ️ [GATE 4] Anchor marker rendered at (139.6917, 35.6895) - independent of buildings/terrain
05:25:45.690 ℹ️ [GATE 4] Anchor marker rendered at (-46.6333, -23.5505) - independent of buildings/terrain
05:25:45.698 ℹ️ [VIS2] expandedSheetsAllowed=true scope=sheet
05:25:45.698 ℹ️ [VIS2] suppressSheetDetail=false expandedSheetsAllowed=true selectedSheet=MFG.MaterialIssues lod=CELL
05:25:45.704 ℹ️ [VIS] sheetOnlyRender sheetsDetailed=1 selected=MFG.MaterialIssues hidden=38
05:25:45.714 ℹ️ [VIS2] sheetTilesRendered count=38
05:25:45.714 ℹ️ [VIS2] enterSheet expanded=1 tiles=38
05:25:45.714 ℹ️ [VIS3.2] sheetOverlay begin sheet=MFG.MaterialIssues scope=sheet
05:25:45.714 ℹ️ [VIS3.2] exceptionRows result=PASS sheet=MFG.MaterialIssues count=0
05:25:45.714 ℹ️ [VIS3.2] routeHighlights result=PASS sheet=MFG.MaterialIssues edges=0
05:25:45.715 ℹ️ [VIS3.2] budget exceptionOverlays=0 routeHighlights=0 capped=false
05:25:45.715 ℹ️ [VIS3.2] gate-summary result=PASS
05:25:45.715 ℹ️ [VIS4] sheetSlabGap enforced minGap=8m raw=2.5m effective=8.0m
05:25:45.715 ℹ️ [VIS4c] labelsRendered count=1 scope=sheet
05:25:45.715 ℹ️ [VIS4] slabsRendered scope=sheet objects=1 slabs=1 capped=false
05:25:45.715 ℹ️ [VIS4] sheetSlabs result=PASS sheet=MFG.MaterialIssues slabs=1
05:25:45.715 ℹ️ [VIS4] gate-summary result=PASS
05:25:45.715 ℹ️ [LOD-BUDGET] frame sheetsDetailed=1 totalMarkers=5 totalPrims=88 totalEntities=92
05:25:45.716 ℹ️ [CAM] dockFaceOn applied=PASS sheet=MFG.MaterialIssues
[2D] gridShown sheet=MFG.MaterialIssues rows=1 cols=5 populated=5 result=PASS
05:25:46.481 ℹ️ [VIS8] mediaPermissions cam=prompt mic=prompt
[VIS8] mediaPermissions cam=prompt mic=prompt
[BoundaryRenderer] ✅ ARG: Loaded 1/1 features
[BoundaryRenderer] Loading GBR from data/boundaries/countries/GBR-ADM0.geojson
05:25:46.748 ℹ️ [HUD] paramsLoaded version=HUD-PARAMS-v0 policyRef=local:HUD-PARAMS-v0
05:25:46.765 ℹ️ [DOCK] dist=105 align=1.00 preview=true edit=false overlay=0.95
05:25:47.254 ℹ️ [VIS] exit sheet=MFG.MaterialIssues restoreView=true
[VIS] exit sheet=MFG.MaterialIssues restoreView=true
[2D] gridHidden reason=exitSheet result=PASS
[VIS] exitSheet cleanup=PASS cleared=sheetId,anchor,selection,forceCompanyScope,explicitEnter,autoDockFlags
05:25:47.254 ℹ️ [VIS] enter company=trunk.avgol
[VIS] enter company=trunk.avgol
05:25:47.255 ℹ️ [LOD] apply level=COMPANY requestedSheetsDetailed=0 effectiveSheetsDetailed=0 lanes=0 markers=0 reason=collapsedByPolicy distKm=1.5
05:25:47.255 ℹ️ [CAM] focusLock target=trunk.avgol scope=company result=PASS
05:25:47.255 ℹ️ [INPUT] owner=CAMERA mode=FreeFly reason=focusLock
05:25:47.255 ℹ️ [LOD] lock level=COMPANY reason=basinFocus
05:25:47.256 ℹ️ [HUD] votes summary=PASS passed=4 pending=2 rejected=0
[HUD] votes summary=PASS passed=4 pending=2 rejected=0
05:25:47.286 ℹ️ [DOCK] assistBlocked policy=launch target=MFG.MaterialIssues dist=105 status="Dock assist blocked by launch policy"
05:25:47.319 ℹ️ [VIS2] expandedSheetsAllowed=false scope=company
05:25:47.319 ℹ️ [VIS2] suppressSheetDetail=true expandedSheetsAllowed=false selectedSheet=none lod=COMPANY
05:25:47.320 ℹ️ [VIS2] deptSpinesRendered count=8
05:25:47.321 ℹ️ [VIS2] companyCollapsed result=PASS sheetsRendered=0 lod=COMPANY scope=company expandedSheetsAllowed=false
05:25:47.327 ℹ️ [VIS2] sheetTilesRendered count=39
05:25:47.327 ℹ️ [VIS2] exitSheet collapsed=PASS expanded=0 tiles=39
05:25:47.328 ℹ️ [VIS3] flowOverlay result=PASS edges=66 exceptions=11 scope=company lod=COMPANY
05:25:47.328 ℹ️ [VIS3] trafficBarsRendered count=8
05:25:47.328 ℹ️ [VIS3] gate-summary result=PASS
05:25:47.331 ℹ️ [VIS4c] labelsRendered count=51 scope=company
05:25:47.331 ℹ️ [VIS4] slabsRendered scope=company objects=14 slabs=51 capped=false
05:25:47.331 ℹ️ [VIS4] companySlabs result=PASS deptBranches=8 trunkSlabs=21
05:25:47.331 ℹ️ [VIS4] gate-summary result=PASS
05:25:47.332 ℹ️ [LOD-BUDGET] frame sheetsDetailed=0 totalMarkers=0 totalPrims=145 totalEntities=132
[BoundaryRenderer] ✅ GBR: Loaded 1/1 features
[BoundaryRenderer] Loading FRA from data/boundaries/countries/FRA-ADM0.geojson